gene_callers_id	contig	start	stop	Archaea_76	Bacteria_71	COG20_CATEGORY	COG20_FUNCTION	COG20_PATHWAY	CyCOGv6	KEGG_BRITE	KEGG_Class	KEGG_Module	KOfam	Protista_83	Ribosomal_RNA_16S	Ribosomal_RNA_23S	Transfer_RNAs	Archaea_76_ACC	Bacteria_71_ACC	COG20_CATEGORY_ACC	COG20_FUNCTION_ACC	COG20_PATHWAY_ACC	CyCOGv6_ACC	KEGG_BRITE_ACC	KEGG_Class_ACC	KEGG_Module_ACC	KOfam_ACC	Protista_83_ACC	Ribosomal_RNA_16S_ACC	Ribosomal_RNA_23S_ACC	Transfer_RNAs_ACC	type
7.0	c_000000000001	10639	11425			Coenzyme transport and metabolism!!!General function prediction only	2-succinyl-6-hydroxy-2,4-cyclohexadiene-1-carboxylate synthase MenH and related esterases, alpha/beta hydrolase fold (MenH) (PDB:4MYS)	Menaquinone biosynthesis		KEGG Orthology (KO)>>>09100 Metabolism>>>09103 Lipid metabolism>>>00561 Glycerolipid metabolism [PATH:ko00561]!!!Enzymes>>>3. Hydrolases>>>3.1  Acting on ester bonds>>>3.1.1  Carboxylic-ester hydrolases>>>3.1.1.3  triacylglycerol lipase	Pathway modules; Lipid metabolism; Lipid metabolism	Acylglycerol degradation	triacylglycerol lipase [EC:3.1.1.3]							H!!!R	COG0596	COG0596		ko00001!!!ko01000	M00098	M00098	K01046					gene
28.0	c_000000000001	32258	33269			Secondary metabolites biosynthesis, transport and catabolism	2-keto-4-pentenoate hydratase/2-oxohepta-3-ene-1,7-dioic acid hydratase (catechol pathway) (YcgM) (PDB:1GTT)			KEGG Orthology (KO)>>>09100 Metabolism>>>09105 Amino acid metabolism>>>00350 Tyrosine metabolism [PATH:ko00350]!!!KEGG Orthology (KO)>>>09100 Metabolism>>>09111 Xenobiotics biodegradation and metabolism>>>00643 Styrene degradation [PATH:ko00643]!!!Enzymes>>>3. Hydrolases>>>3.7  Acting on carbon-carbon bonds>>>3.7.1  In ketonic substances>>>3.7.1.2  fumarylacetoacetase	Pathway modules; Amino acid metabolism; Aromatic amino acid metabolism	Tyrosine degradation, tyrosine => homogentisate	fumarylacetoacetate (FAA) hydrolase [EC:3.7.1.2]							Q	COG0179			ko00001!!!ko00001!!!ko01000	M00044	M00044	K16171					gene
31.0	c_000000000001	35800	36562			Lipid transport and metabolism	Enoyl-CoA hydratase/carnithine racemase (CaiD) (PDB:1DCI)	Fatty acid biosynthesis	1,4-Dihydroxy-2-naphthoyl-CoA synthase	KEGG Orthology (KO)>>>09100 Metabolism>>>09101 Carbohydrate metabolism>>>00640 Propanoate metabolism [PATH:ko00640]!!!KEGG Orthology (KO)>>>09100 Metabolism>>>09101 Carbohydrate metabolism>>>00650 Butanoate metabolism [PATH:ko00650]!!!KEGG Orthology (KO)>>>09100 Metabolism>>>09103 Lipid metabolism>>>00071 Fatty acid degradation [PATH:ko00071]!!!KEGG Orthology (KO)>>>09100 Metabolism>>>09105 Amino acid metabolism>>>00280 Valine, leucine and isoleucine degradation [PATH:ko00280]!!!KEGG Orthology (KO)>>>09100 Metabolism>>>09105 Amino acid metabolism>>>00310 Lysine degradation [PATH:ko00310]!!!KEGG Orthology (KO)>>>09100 Metabolism>>>09105 Amino acid metabolism>>>00360 Phenylalanine metabolism [PATH:ko00360]!!!KEGG Orthology (KO)>>>09100 Metabolism>>>09105 Amino acid metabolism>>>00380 Tryptophan metabolism [PATH:ko00380]!!!KEGG Orthology (KO)>>>09100 Metabolism>>>09106 Metabolism of other amino acids>>>00410 beta-Alanine metabolism [PATH:ko00410]!!!KEGG Orthology (KO)>>>09100 Metabolism>>>09109 Metabolism of terpenoids and polyketides>>>00907 Pinene, camphor and geraniol degradation [PATH:ko00907]!!!KEGG Orthology (KO)>>>09100 Metabolism>>>09111 Xenobiotics biodegradation and metabolism>>>00362 Benzoate degradation [PATH:ko00362]!!!KEGG Orthology (KO)>>>09100 Metabolism>>>09111 Xenobiotics biodegradation and metabolism>>>00627 Aminobenzoate degradation [PATH:ko00627]!!!KEGG Orthology (KO)>>>09100 Metabolism>>>09111 Xenobiotics biodegradation and metabolism>>>00930 Caprolactam degradation [PATH:ko00930]!!!Enzymes>>>4. Lyases>>>4.2  Carbon-oxygen lyases>>>4.2.1  Hydro-lyases>>>4.2.1.17  enoyl-CoA hydratase	Pathway modules; Lipid metabolism; Fatty acid metabolism!!!Pathway modules; Amino acid metabolism; Lysine metabolism!!!Pathway modules; Xenobiotics biodegradation; Aromatics degradation	beta-Oxidation!!!Lysine degradation, bacteria, L-lysine => glutarate => succinate/acetyl-CoA!!!Phenylacetate degradation, phenylaxetate => acetyl-CoA/succinyl-CoA	enoyl-CoA hydratase [EC:4.2.1.17]							I	COG1024	COG1024	CyCOG_60000837	ko00001!!!ko00001!!!ko00001!!!ko00001!!!ko00001!!!ko00001!!!ko00001!!!ko00001!!!ko00001!!!ko00001!!!ko00001!!!ko00001!!!ko01000	M00087!!!M00957!!!M00878	M00087!!!M00957!!!M00878	K01692					gene
32.0	c_000000000001	36679	37948			Lipid transport and metabolism	Acetyl-CoA acetyltransferase (PaaJ) (PDB:1AFW)	Fatty acid biosynthesis	acetyl-CoA acyltransferase 2	KEGG Orthology (KO)>>>09100 Metabolism>>>09101 Carbohydrate metabolism>>>00620 Pyruvate metabolism [PATH:ko00620]!!!KEGG Orthology (KO)>>>09100 Metabolism>>>09101 Carbohydrate metabolism>>>00630 Glyoxylate and dicarboxylate metabolism [PATH:ko00630]!!!KEGG Orthology (KO)>>>09100 Metabolism>>>09101 Carbohydrate metabolism>>>00650 Butanoate metabolism [PATH:ko00650]!!!KEGG Orthology (KO)>>>09100 Metabolism>>>09102 Energy metabolism>>>00720 Carbon fixation pathways in prokaryotes [PATH:ko00720]!!!KEGG Orthology (KO)>>>09100 Metabolism>>>09103 Lipid metabolism>>>00071 Fatty acid degradation [PATH:ko00071]!!!KEGG Orthology (KO)>>>09100 Metabolism>>>09105 Amino acid metabolism>>>00280 Valine, leucine and isoleucine degradation [PATH:ko00280]!!!KEGG Orthology (KO)>>>09100 Metabolism>>>09105 Amino acid metabolism>>>00310 Lysine degradation [PATH:ko00310]!!!KEGG Orthology (KO)>>>09100 Metabolism>>>09105 Amino acid metabolism>>>00380 Tryptophan metabolism [PATH:ko00380]!!!KEGG Orthology (KO)>>>09100 Metabolism>>>09109 Metabolism of terpenoids and polyketides>>>00900 Terpenoid backbone biosynthesis [PATH:ko00900]!!!KEGG Orthology (KO)>>>09100 Metabolism>>>09111 Xenobiotics biodegradation and metabolism>>>00362 Benzoate degradation [PATH:ko00362]!!!KEGG Orthology (KO)>>>09130 Environmental Information Processing>>>09132 Signal transduction>>>02020 Two-component system [PATH:ko02020]!!!Enzymes>>>2. Transferases>>>2.3  Acyltransferases>>>2.3.1  Transferring groups other than aminoacyl groups>>>2.3.1.9  acetyl-CoA C-acetyltransferase!!!Exosome>>>Exosomal proteins>>>Exosomal proteins of other body fluids (saliva and urine)	Pathway modules; Carbohydrate metabolism; Other carbohydrate metabolism!!!Pathway modules; Energy metabolism; Carbon fixation!!!Pathway modules; Energy metabolism; Carbon fixation!!!Pathway modules; Lipid metabolism; Lipid metabolism!!!Pathway modules; Amino acid metabolism; Lysine metabolism!!!Pathway modules; Biosynthesis of terpenoids and polyketides; Terpenoid backbone biosynthesis!!!Pathway modules; Biosynthesis of terpenoids and polyketides; Terpenoid backbone biosynthesis	Ethylmalonyl pathway!!!Hydroxypropionate-hydroxybutylate cycle!!!Dicarboxylate-hydroxybutyrate cycle!!!Ketone body biosynthesis, acetyl-CoA => acetoacetate/3-hydroxybutyrate/acetone!!!Lysine degradation, bacteria, L-lysine => glutarate => succinate/acetyl-CoA!!!C5 isoprenoid biosynthesis, mevalonate pathway!!!C5 isoprenoid biosynthesis, mevalonate pathway, archaea	acetyl-CoA C-acetyltransferase [EC:2.3.1.9]							I	COG0183	COG0183	CyCOG_60039675	ko00001!!!ko00001!!!ko00001!!!ko00001!!!ko00001!!!ko00001!!!ko00001!!!ko00001!!!ko00001!!!ko00001!!!ko00001!!!ko01000!!!ko04147	M00373!!!M00375!!!M00374!!!M00088!!!M00957!!!M00095!!!M00849	M00373!!!M00375!!!M00374!!!M00088!!!M00957!!!M00095!!!M00849	K00626					gene
43.0	c_000000000001	47546	48380			Inorganic ion transport and metabolism	3-mercaptopyruvate sulfurtransferase SseA, contains two rhodanese domains (SseA) (PDB:1BOH)		Rhodanese-like domain-containing protein	KEGG Orthology (KO)>>>09100 Metabolism>>>09102 Energy metabolism>>>00920 Sulfur metabolism [PATH:ko00920]!!!KEGG Orthology (KO)>>>09100 Metabolism>>>09105 Amino acid metabolism>>>00270 Cysteine and methionine metabolism [PATH:ko00270]!!!KEGG Orthology (KO)>>>09120 Genetic Information Processing>>>09123 Folding, sorting and degradation>>>04122 Sulfur relay system [PATH:ko04122]!!!Enzymes>>>2. Transferases>>>2.8  Transferring sulfur-containing groups>>>2.8.1  Sulfurtransferases>>>2.8.1.1  thiosulfate sulfurtransferase!!!Enzymes>>>2. Transferases>>>2.8  Transferring sulfur-containing groups>>>2.8.1  Sulfurtransferases>>>2.8.1.2  3-mercaptopyruvate sulfurtransferase			thiosulfate/3-mercaptopyruvate sulfurtransferase [EC:2.8.1.1 2.8.1.2]							P	COG2897		CyCOG_60040281	ko00001!!!ko00001!!!ko00001!!!ko01000!!!ko01000			K01011					gene
45.0	c_000000000001	49658	50117			Translation, ribosomal structure and biogenesis	NADPH-dependent 7-cyano-7-deazaguanine reductase QueF, C-terminal domain, T-fold superfamily (QueFC) (PDB:3BP1) (PUBMED:14660578;17384645)	tRNA modification	7-cyano-7-deazaguanine reductase	KEGG Orthology (KO)>>>09100 Metabolism>>>09108 Metabolism of cofactors and vitamins>>>00790 Folate biosynthesis [PATH:ko00790]!!!Enzymes>>>1. Oxidoreductases>>>1.7  Acting on other nitrogenous compounds as donors>>>1.7.1  With NAD+ or NADP+ as acceptor>>>1.7.1.13  preQ1 synthase!!!Transfer RNA biogenesis>>>Prokaryotic type>>>tRNA modification factors>>>Other tRNA modification factors			7-cyano-7-deazaguanine reductase [EC:1.7.1.13]							J	COG0780	COG0780	CyCOG_60000589	ko00001!!!ko01000!!!ko03016			K09457					gene
46.0	c_000000000001	50438	50819			Posttranslational modification, protein turnover, chaperones	Heat shock protein HspQ (HspQ) (PDB:5YCQ)			Chromosome and associated proteins>>>Prokaryotic type>>>Nucleoid associated proteins>>>Other nucleoid associated proteins			heat shock protein HspQ							O	COG3785			ko03036			K11940					gene
65.0	c_000000000001	68827	69406			Translation, ribosomal structure and biogenesis	Ribosome maturation factor RimP (RimP) (PDB:1IB8)		ribosome maturation factor RimP	Ribosome biogenesis>>>Prokaryotic type>>>Other maturation factors			ribosome maturation factor RimP							J	COG0779		CyCOG_60001641	ko03009			K09748					gene
66.0	c_000000000001	69605	70631			Transcription!!!Signal transduction mechanisms	FhlA-type transcriptional regulator, contains GAF, AAA-type ATPase, and DNA-binding Fis domains (FhlA)		sigma-54 dependent trancsriptional regulator	Transcription factors>>>Prokaryotic type>>>Other transcription factors>>>Others			psp operon transcriptional activator							K!!!T	COG3604		CyCOG_60031780	ko03000			K03974					gene
70.0	c_000000000001	72143	72521			Transcription!!!Signal transduction mechanisms	Phage shock protein PspC (stress-responsive transcriptional regulator) (PspC)			Transcription factors>>>Prokaryotic type>>>Other transcription factors>>>Others!!!Prokaryotic defense system>>>Toxin-antitoxin system (TA system)>>>Type II TA system>>>PspC-PspB			phage shock protein C							K!!!T	COG1983			ko03000!!!ko02048			K03973					gene
82.0	c_000000000001	76185	76611			Lipid transport and metabolism	Acyl-CoA thioesterase FadM (FadM) (PDB:2FUJ)	Menaquinone biosynthesis		KEGG Orthology (KO)>>>09190 Not Included in Pathway or Brite>>>09191 Unclassified: metabolism>>>99980 Enzymes with EC numbers!!!Enzymes>>>3. Hydrolases>>>3.1  Acting on ester bonds>>>3.1.2  Thioester hydrolases>>>3.1.2.-			acyl-CoA thioester hydrolase [EC:3.1.2.-]							I	COG0824	COG0824		ko00001!!!ko01000			K07107					gene
83.0	c_000000000001	76702	78160			Amino acid transport and metabolism	Homoaconitase/3-isopropylmalate dehydratase large subunit (LeuC) (PDB:4KP1)	Isoleucine, leucine, valine biosynthesis	3-isopropylmalate dehydratase, large subunit	KEGG Orthology (KO)>>>09100 Metabolism>>>09101 Carbohydrate metabolism>>>00660 C5-Branched dibasic acid metabolism [PATH:ko00660]!!!KEGG Orthology (KO)>>>09100 Metabolism>>>09105 Amino acid metabolism>>>00290 Valine, leucine and isoleucine biosynthesis [PATH:ko00290]!!!KEGG Orthology (KO)>>>09100 Metabolism>>>09110 Biosynthesis of other secondary metabolites>>>00966 Glucosinolate biosynthesis [PATH:ko00966]!!!Enzymes>>>4. Lyases>>>4.2  Carbon-oxygen lyases>>>4.2.1  Hydro-lyases>>>4.2.1.33  3-isopropylmalate dehydratase!!!Enzymes>>>4. Lyases>>>4.2  Carbon-oxygen lyases>>>4.2.1  Hydro-lyases>>>4.2.1.35  (R)-2-methylmalate dehydratase	Pathway modules; Amino acid metabolism; Branched-chain amino acid metabolism!!!Pathway modules; Amino acid metabolism; Branched-chain amino acid metabolism	Isoleucine biosynthesis, pyruvate => 2-oxobutanoate!!!Leucine biosynthesis, 2-oxoisovalerate => 2-oxoisocaproate	3-isopropylmalate/(R)-2-methylmalate dehydratase large subunit [EC:4.2.1.33 4.2.1.35]							E	COG0065	COG0065	CyCOG_60000056	ko00001!!!ko00001!!!ko00001!!!ko01000!!!ko01000	M00535!!!M00432	M00535!!!M00432	K01703					gene
91.0	c_000000000001	82366	84766			Signal transduction mechanisms!!!Signal transduction mechanisms!!!Signal transduction mechanisms!!!Signal transduction mechanisms!!!Signal transduction mechanisms	Signal transduction histidine kinase (BaeS) (PDB:1JOY)!!!CheY-like REC (receiver) domain, includes chemotaxis protein CheY  and sporulation regulator Spo0F (CheY) (PDB:6QRJ)!!!PAS domain (PAS) (PDB:2MWG)!!!Integral membrane sensor domain MASE1 (MASE1)!!!Extracytoplasmic sensor domain CHASE1 (specificity unknown) (CHASE1) (PDB:3T4J)		PAS protein	KEGG Orthology (KO)>>>09130 Environmental Information Processing>>>09132 Signal transduction>>>02020 Two-component system [PATH:ko02020]!!!KEGG Orthology (KO)>>>09140 Cellular Processes>>>09145 Cellular community - prokaryotes>>>02025 Biofilm formation - Pseudomonas aeruginosa [PATH:ko02025]!!!Enzymes>>>2. Transferases>>>2.7  Transferring phosphorus-containing groups>>>2.7.13  Protein-histidine kinases>>>2.7.13.3  histidine kinase!!!Protein kinases>>>Histidine kinases>>>Other!!!Two-component system>>>Other families>>>SagS-HptB-HsbR (swarming activity and biofilm formation)			two-component system, sensor histidine kinase [EC:2.7.13.3]							T!!!T!!!T!!!T!!!T	COG0642!!!COG0784!!!COG2202!!!COG3447!!!COG3614		CyCOG_60031048	ko00001!!!ko00001!!!ko01000!!!ko01001!!!ko02022			K20974					gene
102.0	c_000000000001	96568	97195			Cell wall/membrane/envelope biogenesis!!!Signal transduction mechanisms	Membrane-bound lytic murein transglycosylase MltF (MltF) (PDB:4OWD)		soluble lytic murein transglycosylase	Enzymes>>>4. Lyases>>>4.2  Carbon-oxygen lyases>>>4.2.2  Acting on polysaccharides>>>4.2.2.-!!!Peptidoglycan biosynthesis and degradation proteins>>>Peptidoglycan biosynthesis and degradation>>>Lytic transglycosylase			soluble lytic murein transglycosylase [EC:4.2.2.-]							M!!!T	COG4623		CyCOG_60002061	ko01000!!!ko01011			K08309					gene
105.0	c_000000000001	99682	102433			Inorganic ion transport and metabolism	Outer membrane receptor for ferrienterochelin and colicins (FepA) (PDB:2HDF) (PUBMED:16468998)		Outer membrane receptor proteins, mostly Fe transport	Transporters>>>Other transporters>>>Pores ion channels [TC:1]			iron complex outermembrane recepter protein							P	COG4771		CyCOG_60024260	ko02000			K02014					gene
106.0	c_000000000001	102551	103361			Translation, ribosomal structure and biogenesis	Methionine aminopeptidase (Map) (PDB:3J2I)		methionine aminopeptidase, type I	Enzymes>>>3. Hydrolases>>>3.4  Acting on peptide bonds (peptidases)>>>3.4.11  Aminopeptidases>>>3.4.11.18  methionyl aminopeptidase!!!Peptidases and inhibitors>>>Metallo peptidases>>>Family M24			methionyl aminopeptidase [EC:3.4.11.18]							J	COG0024		CyCOG_60000702	ko01000!!!ko01002			K01265					gene
112.0	c_000000000001	107410	108388			General function prediction only	NAD(P)H-dependent flavin oxidoreductase YrpB, nitropropane dioxygenase family (YrpB)			KEGG Orthology (KO)>>>09190 Not Included in Pathway or Brite>>>09191 Unclassified: metabolism>>>99980 Enzymes with EC numbers!!!Enzymes>>>1. Oxidoreductases>>>1.6  Acting on NADH or NADPH>>>1.6.5  With a quinone or similar compound as acceptor>>>1.6.5.9  NADH:quinone reductase (non-electrogenic)			NADH:quinone reductase (non-electrogenic) [EC:1.6.5.9]							R	COG2070			ko00001!!!ko01000			K23948					gene
113.0	c_000000000001	108448	109039			Energy production and conversion	FMN reductase RutF, DIM6/NTAB family (RutF) (PDB:1EJE)	Pyrimidine degradation	NADH-FMN oxidoreductase RutF, flavin reductase (DIM6/NTAB) family											C	COG1853	COG1853	CyCOG_60001239									gene
120.0	c_000000000001	115784	117521			Lipid transport and metabolism	O-succinylbenzoic acid-CoA ligase MenE or related acyl-CoA synthetase (AMP-forming) (MenE/FadK) (PDB:5EY9) (PUBMED:25151136;27455459)	Menaquinone biosynthesis	long-chain acyl-CoA synthetase	KEGG Orthology (KO)>>>09190 Not Included in Pathway or Brite>>>09191 Unclassified: metabolism>>>99980 Enzymes with EC numbers!!!Enzymes>>>6. Ligases>>>6.2  Forming carbon-sulfur bonds>>>6.2.1  Acid-thiol ligases>>>6.2.1.-			steroid-24-oyl-CoA synthetase [EC:6.2.1.-]							I	COG0318	COG0318	CyCOG_60007539	ko00001!!!ko01000			K25775					gene
121.0	c_000000000001	117699	118935			Defense mechanisms	CubicO group peptidase, beta-lactamase class C family (AmpC) (PDB:1BLS)													V	COG1680											gene
136.0	c_000000000001	138468	139350			Cell wall/membrane/envelope biogenesis	Curli biogenesis system outer membrane secretion channel CsgG (CsgG) (PDB:3X2R) (PUBMED:24417346)			KEGG Orthology (KO)>>>09140 Cellular Processes>>>09143 Cell growth and death>>>04112 Cell cycle - Caulobacter [PATH:ko04112]			holdfast attachment protein HfaB							M	COG1462			ko00001			K13586					gene
157.0	c_000000000001	155092	155749			Cell motility	Flagellar motor component MotA (MotA)			KEGG Orthology (KO)>>>09130 Environmental Information Processing>>>09132 Signal transduction>>>02020 Two-component system [PATH:ko02020]!!!KEGG Orthology (KO)>>>09140 Cellular Processes>>>09142 Cell motility>>>02030 Bacterial chemotaxis [PATH:ko02030]!!!KEGG Orthology (KO)>>>09140 Cellular Processes>>>09142 Cell motility>>>02040 Flagellar assembly [PATH:ko02040]!!!Transporters>>>Other transporters>>>Pores ion channels [TC:1]!!!Bacterial motility proteins>>>Flagellar system>>>Flagellar assembly proteins>>>Stator			chemotaxis protein MotA							N	COG1291			ko00001!!!ko00001!!!ko00001!!!ko02000!!!ko02035			K02556					gene
184.0	c_000000000001	176817	177645			Cell motility	Flagellin and related hook-associated protein FlgL (FlgL) (PDB:1IO1)			KEGG Orthology (KO)>>>09130 Environmental Information Processing>>>09132 Signal transduction>>>02020 Two-component system [PATH:ko02020]!!!KEGG Orthology (KO)>>>09140 Cellular Processes>>>09142 Cell motility>>>02040 Flagellar assembly [PATH:ko02040]!!!Bacterial motility proteins>>>Flagellar system>>>Flagellar assembly proteins>>>Filament			flagellin							N	COG1344			ko00001!!!ko00001!!!ko02035			K02406					gene
191.0	c_000000000001	188876	189302			Signal transduction mechanisms	CheY-like REC (receiver) domain, includes chemotaxis protein CheY  and sporulation regulator Spo0F (CheY) (PDB:6QRJ)													T	COG0784											gene
195.0	c_000000000001	199293	200799			Inorganic ion transport and metabolism	Sulfate permease or related transporter, MFS superfamily (SUL1) (PDB:3NY7)		sulfate permease, SulP family	Transporters>>>Other transporters>>>Electrochemical potential-driven transporters [TC:2]			sulfate permease, SulP family							P	COG0659		CyCOG_60000820	ko02000			K03321					gene
196.0	c_000000000001	200919	201603			Defense mechanisms	Protein/nucleotide deglycase, PfpI/YajL/DJ-1 family (repair of methylglyoxal-glycated proteins and nucleic acids) (YajL) (PDB:5SY4) (PUBMED:19028889;28596309;26678554)		Putative intracellular protease/amidase											V	COG0693		CyCOG_60008941									gene
204.0	c_000000000001	206344	207736			Translation, ribosomal structure and biogenesis	Ribosomal protein L11 methylase PrmA (PrmA) (PDB:3GRZ)													J	COG2264											gene
207.0	c_000000000001	209929	210481			Replication, recombination and repair	Single-stranded DNA-binding protein (Ssb) (PDB:1EQQ)		single-strand binding protein	KEGG Orthology (KO)>>>09120 Genetic Information Processing>>>09124 Replication and repair>>>03030 DNA replication [PATH:ko03030]!!!KEGG Orthology (KO)>>>09120 Genetic Information Processing>>>09124 Replication and repair>>>03430 Mismatch repair [PATH:ko03430]!!!KEGG Orthology (KO)>>>09120 Genetic Information Processing>>>09124 Replication and repair>>>03440 Homologous recombination [PATH:ko03440]!!!DNA replication proteins>>>Prokaryotic type>>>DNA Replication Initiation Factors>>>Initiation factors (bacterial)!!!DNA repair and recombination proteins>>>Prokaryotic type>>>TLS (translesion DNA synthesis) factors>>>Other SOS response factors!!!DNA repair and recombination proteins>>>Prokaryotic type>>>SSBR (single strand breaks repair)>>>MMR (mismatch excision repair)>>>Other MMR factors!!!Mitochondrial biogenesis>>>Mitochondrial DNA transcription, translation, and replication factors>>>Mitochondrial DNA replication factors>>>Other Mitochondrial DNA replication factors			single-strand DNA-binding protein							L	COG0629		CyCOG_60000357	ko00001!!!ko00001!!!ko00001!!!ko03032!!!ko03400!!!ko03400!!!ko03029			K03111					gene
208.0	c_000000000001	210580	212428			Inorganic ion transport and metabolism	Fe2+ transporter FeoB (FeoB) (PDB:3TAH) (PUBMED:32095817)		ferrous iron transport protein B	Transporters>>>Other transporters>>>Others			ferrous iron transport protein B							P	COG0370		CyCOG_60004082	ko02000			K04759					gene
211.0	c_000000000001	213395	214031			Signal transduction mechanisms	Ankyrin repeat (ANKYR) (PDB:6AUN)			Chromosome and associated proteins>>>Eukaryotic type>>>Histone modification proteins>>>HDAC complexes>>>Other HDAC associated proteins			uncharacterized protein							T	COG0666			ko03036			K06867					gene
212.0	c_000000000001	214069	214669			Posttranslational modification, protein turnover, chaperones	Cytochrome oxidase Cu insertion factor, SCO1/SenC/PrrC family (Sco1) (PDB:1ON4)			Mitochondrial biogenesis>>>Mitochondrial quality control factors>>>Mitochondrial respiratory chain complex assembly factors>>>Complex-IV assembly factors			protein SCO1							O	COG1999			ko03029			K07152					gene
219.0	c_000000000001	218524	219034			Replication, recombination and repair	DNA uptake protein ComE or related DNA-binding protein (ComEA) (PDB:2DUY)													L	COG1555											gene
220.0	c_000000000001	219281	219821			Translation, ribosomal structure and biogenesis!!!Posttranslational modification, protein turnover, chaperones	Protein N-acetyltransferase, RimJ/RimL family (RimL) (PDB:1S7F)			KEGG Orthology (KO)>>>09190 Not Included in Pathway or Brite>>>09191 Unclassified: metabolism>>>99985 Amino acid metabolism			N-acetyltransferase							J!!!O	COG1670			ko00001			K22479					gene
222.0	c_000000000001	221120	221921			Function unknown	Uncharacterized conserved protein (PDB:5UC0)													S	COG5400											gene
223.0	c_000000000001	222474	223203			Inorganic ion transport and metabolism	Carbonic anhydrase (CynT) (PDB:1EKJ) (PUBMED:22081392)		carbonic anhydrase	KEGG Orthology (KO)>>>09100 Metabolism>>>09102 Energy metabolism>>>00910 Nitrogen metabolism [PATH:ko00910]!!!Enzymes>>>4. Lyases>>>4.2  Carbon-oxygen lyases>>>4.2.1  Hydro-lyases>>>4.2.1.1  carbonic anhydrase			carbonic anhydrase [EC:4.2.1.1]							P	COG0288		CyCOG_60003120	ko00001!!!ko01000			K01673					gene
226.0	c_000000000001	225454	225664							KEGG Orthology (KO)>>>09190 Not Included in Pathway or Brite>>>09194 Poorly characterized>>>99997 Function unknown			uncharacterized protein											ko00001			K09794					gene
227.0	c_000000000001	225765	226686			Transcription	DNA-binding transcriptional regulator, LysR family (LysR) (PDB:2FYI)		DNA-binding transcriptional regulator, LysR family	KEGG Orthology (KO)>>>09140 Cellular Processes>>>09145 Cellular community - prokaryotes>>>02026 Biofilm formation - Escherichia coli [PATH:ko02026]!!!Transcription factors>>>Prokaryotic type>>>Helix-turn-helix>>>LysR family			LysR family transcriptional regulator, hydrogen peroxide-inducible genes activator							K	COG0583		CyCOG_60000237	ko00001!!!ko03000			K04761					gene
230.0	c_000000000001	229057	229669			Transcription	DNA-binding transcriptional regulator, PadR family (PadR) (PDB:1XMA) (PUBMED:19096365)													K	COG1695											gene
242.0	c_000000000001	244688	245576			Lipid transport and metabolism	Acetyl esterase/lipase (Aes) (PDB:1EVQ)		Dipeptidyl aminopeptidase/acylaminoacyl peptidase											I	COG0657		CyCOG_60000394									gene
243.0	c_000000000001	245699	248546			Inorganic ion transport and metabolism	Outer membrane receptor for ferrienterochelin and colicins (FepA) (PDB:2HDF) (PUBMED:16468998)			Transporters>>>Other transporters>>>Pores ion channels [TC:1]			iron complex outermembrane recepter protein							P	COG4771			ko02000			K02014					gene
247.0	c_000000000001	252660	253434			Lipid transport and metabolism	NAD(P)-dependent dehydrogenase, short-chain alcohol dehydrogenase family (FabG) (PDB:6L1H)	Fatty acid biosynthesis	2-deoxy-D-gluconate 3-dehydrogenase	KEGG Orthology (KO)>>>09100 Metabolism>>>09103 Lipid metabolism>>>00061 Fatty acid biosynthesis [PATH:ko00061]!!!KEGG Orthology (KO)>>>09100 Metabolism>>>09108 Metabolism of cofactors and vitamins>>>00780 Biotin metabolism [PATH:ko00780]!!!KEGG Orthology (KO)>>>09100 Metabolism>>>09110 Biosynthesis of other secondary metabolites>>>00333 Prodigiosin biosynthesis [PATH:ko00333]!!!Enzymes>>>1. Oxidoreductases>>>1.1  Acting on the CH-OH group of donors>>>1.1.1  With NAD+ or NADP+ as acceptor>>>1.1.1.100  3-oxoacyl-[acyl-carrier-protein] reductase!!!Lipid biosynthesis proteins>>>Fatty acid synthase>>>Component type	Pathway modules; Lipid metabolism; Fatty acid metabolism!!!Pathway modules; Lipid metabolism; Fatty acid metabolism!!!Pathway modules; Metabolism of cofactors and vitamins; Cofactor and vitamin metabolism	Fatty acid biosynthesis, elongation!!!Fatty acid biosynthesis in mitochondria, fungi!!!Pimeloyl-ACP biosynthesis, BioC-BioH pathway, malonyl-ACP => pimeloyl-ACP	2-dehydro-3-deoxy-D-gluconate 5-dehydrogenase [EC:1.1.1.127]							I	COG1028	COG1028	CyCOG_60004845	ko00001!!!ko00001!!!ko00001!!!ko01000!!!ko01004	M00083!!!M00874!!!M00572	M00083!!!M00874!!!M00572	K00065					gene
