3032.0	c_000000000002	2995706	2997902			Energy production and conversion	Aldehyde, CO or xanthine dehydrogenase, Mo-binding subunit (CoxL) (PDB:1DGJ) (PUBMED:10095793)	Non-phosphorylated Entner-Doudoroff pathway		KEGG Orthology (KO)>>>09100 Metabolism>>>09104 Nucleotide metabolism>>>00230 Purine metabolism [PATH:ko00230]!!!Enzymes>>>1. Oxidoreductases>>>1.17  Acting on CH or CH2 groups>>>1.17.1  With NAD+ or NADP+ as acceptor>>>1.17.1.4  xanthine dehydrogenase	Pathway modules; Nucleotide metabolism; Purine metabolism!!!Pathway modules; Nucleotide metabolism; Purine metabolism!!!Pathway modules; Nucleotide metabolism; Purine metabolism	Adenine ribonucleotide degradation, AMP => Urate!!!Guanine ribonucleotide degradation, GMP => Urate!!!Purine degradation, xanthine => urea	xanthine dehydrogenase YagR molybdenum-binding subunit [EC:1.17.1.4]							C	COG1529	COG1529		ko00001!!!ko01000	M00958!!!M00959!!!M00546	M00958!!!M00959!!!M00546	K11177					gene
3034.0	c_000000000002	2998866	2999376			Energy production and conversion	Aldehyde, CO, or xanthine dehydrogenase, Fe-S subunit, CoxS/CutS family (CutS) (PDB:1FFU) (PUBMED:21175741)	Non-phosphorylated Entner-Doudoroff pathway	2Fe-2S iron-sulfur cluster binding domain-containing protein	KEGG Orthology (KO)>>>09100 Metabolism>>>09104 Nucleotide metabolism>>>00230 Purine metabolism [PATH:ko00230]	Pathway modules; Nucleotide metabolism; Purine metabolism!!!Pathway modules; Nucleotide metabolism; Purine metabolism!!!Pathway modules; Nucleotide metabolism; Purine metabolism	Adenine ribonucleotide degradation, AMP => Urate!!!Guanine ribonucleotide degradation, GMP => Urate!!!Purine degradation, xanthine => urea	xanthine dehydrogenase YagT iron-sulfur-binding subunit							C	COG2080	COG2080	CyCOG_60029404	ko00001	M00958!!!M00959!!!M00546	M00958!!!M00959!!!M00546	K13483					gene
3050.0	c_000000000002	3015868	3016333			Transcription	DNA-binding transcriptional regulator, Lrp family (Lrp) (PDB:1I1G)			Transcription factors>>>Prokaryotic type>>>Helix-turn-helix>>>Lrp/AsnC family!!!Chromosome and associated proteins>>>Prokaryotic type>>>Nucleoid associated proteins>>>Other nucleoid associated proteins			Lrp/AsnC family transcriptional regulator, leucine-responsive regulatory protein							K	COG1522			ko03000!!!ko03036			K03719					gene
3057.0	c_000000000002	3020827	3021766			Amino acid transport and metabolism	Glutaminase (GlsA) (PDB:1MKI)		glutaminase A	KEGG Orthology (KO)>>>09100 Metabolism>>>09105 Amino acid metabolism>>>00250 Alanine, aspartate and glutamate metabolism [PATH:ko00250]!!!KEGG Orthology (KO)>>>09100 Metabolism>>>09105 Amino acid metabolism>>>00220 Arginine biosynthesis [PATH:ko00220]!!!KEGG Orthology (KO)>>>09100 Metabolism>>>09106 Metabolism of other amino acids>>>00470 D-Amino acid metabolism [PATH:ko00470]!!!KEGG Orthology (KO)>>>09130 Environmental Information Processing>>>09132 Signal transduction>>>02020 Two-component system [PATH:ko02020]!!!Enzymes>>>3. Hydrolases>>>3.5  Acting on carbon-nitrogen bonds, other than peptide bonds>>>3.5.1  In linear amides>>>3.5.1.2  glutaminase			glutaminase [EC:3.5.1.2]							E	COG2066		CyCOG_60006862	ko00001!!!ko00001!!!ko00001!!!ko00001!!!ko01000			K01425					gene
3058.0	c_000000000002	3021918	3022536			Translation, ribosomal structure and biogenesis	Ribosomal protein S4 or related protein (RpsD) (PDB:4V4H)	Ribosome 30S subunit	SSU ribosomal protein S4P	KEGG Orthology (KO)>>>09120 Genetic Information Processing>>>09122 Translation>>>03010 Ribosome [PATH:ko03010]!!!Ribosome>>>Ribosomal proteins>>>Bacteria>>>Small subunit!!!Ribosome>>>Ribosomal proteins>>>Archaea>>>Small subunit			small subunit ribosomal protein S4							J	COG0522	COG0522	CyCOG_60000776	ko00001!!!ko03011!!!ko03011			K02986					gene
3062.0	c_000000000002	3025996	3029950			Translation, ribosomal structure and biogenesis	Alanyl-tRNA synthetase (AlaS) (PDB:2ZZE)	Aminoacyl-tRNA synthetases	alanyl-tRNA synthetase	KEGG Orthology (KO)>>>09120 Genetic Information Processing>>>09122 Translation>>>00970 Aminoacyl-tRNA biosynthesis [PATH:ko00970]!!!Enzymes>>>6. Ligases>>>6.1  Forming carbon-oxygen bonds>>>6.1.1  Ligases forming aminoacyl-tRNA and related compounds>>>6.1.1.7  alanine---tRNA ligase!!!Amino acid related enzymes>>>Aminoacyl-tRNA synthetase>>>Class II (C/G)!!!Transfer RNA biogenesis>>>Eukaryotic type>>>Aminoacyl-tRNA synthetases (AARSs)>>>Other AARSs!!!Transfer RNA biogenesis>>>Prokaryotic type>>>Aminoacyl-tRNA synthetases (AARSs)>>>Other AARSs			alanyl-tRNA synthetase [EC:6.1.1.7]							J	COG0013	COG0013	CyCOG_60000068	ko00001!!!ko01000!!!ko01007!!!ko03016!!!ko03016			K01872					gene
3063.0	c_000000000002	3030197	3031112			Carbohydrate transport and metabolism	Sugar or nucleoside kinase, ribokinase family (RbsK) (PDB:2QCV)	Glycolysis												G	COG0524	COG0524										gene
3066.0	c_000000000002	3032973	3033624			Cell wall/membrane/envelope biogenesis	Outer membrane protein OmpA and related peptidoglycan-associated (lipo)proteins (OmpA) (PDB:1OAP)		OmpA family protein	Transporters>>>Other transporters>>>Pores ion channels [TC:1]			OmpA-OmpF porin, OOP family							M	COG2885		CyCOG_60003776	ko02000			K03286					gene
3067.0	c_000000000002	3033730	3034600			Transcription	AraC-type DNA-binding domain and AraC-containing proteins (AraC) (PDB:1BL0)													K	COG2207											gene
3070.0	c_000000000002	3037290	3038310			Signal transduction mechanisms!!!Signal transduction mechanisms!!!Signal transduction mechanisms	Signal transduction histidine kinase (BaeS) (PDB:1JOY)!!!CheY-like REC (receiver) domain, includes chemotaxis protein CheY  and sporulation regulator Spo0F (CheY) (PDB:6QRJ)!!!PAS domain (PAS) (PDB:2MWG)													T!!!T!!!T	COG0642!!!COG0784!!!COG2202											gene
3071.0	c_000000000002	3038614	3039799			Cell motility	Flagellar biogenesis protein FliO (FliO)			KEGG Orthology (KO)>>>09140 Cellular Processes>>>09142 Cell motility>>>02040 Flagellar assembly [PATH:ko02040]!!!Secretion system>>>Type III secretion system>>>Flagellar export apparatus!!!Bacterial motility proteins>>>Flagellar system>>>Flagellar assembly proteins>>>Type-III secretion			flagellar protein FliO/FliZ							N	COG3190			ko00001!!!ko02044!!!ko02035			K02418					gene
3072.0	c_000000000002	3040074	3040494			Transcription	RNA polymerase-binding transcription factor DksA (DksA) (PDB:1TJL)			KEGG Orthology (KO)>>>09140 Cellular Processes>>>09145 Cellular community - prokaryotes>>>02026 Biofilm formation - Escherichia coli [PATH:ko02026]!!!Transcription factors>>>Prokaryotic type>>>Other transcription factors>>>Others!!!Transcription machinery>>>Prokaryotic type>>>Bacterial type>>>Other transcription-related factors>>>Transcription elongation factors!!!Ribosome biogenesis>>>Prokaryotic type>>>rRNA transcription factors			RNA polymerase-binding transcription factor							K	COG1734			ko00001!!!ko03000!!!ko03021!!!ko03009			K06204					gene
3073.0	c_000000000002	3040765	3041299			Signal transduction mechanisms	Phosphohistidine phosphatase SixA (SixA) (PDB:1UJB)			KEGG Orthology (KO)>>>09190 Not Included in Pathway or Brite>>>09191 Unclassified: metabolism>>>99980 Enzymes with EC numbers!!!Enzymes>>>3. Hydrolases>>>3.1  Acting on ester bonds>>>3.1.3  Phosphoric-monoester hydrolases>>>3.1.3.-			phosphohistidine phosphatase [EC:3.1.3.-]							T	COG2062			ko00001!!!ko01000			K08296					gene
3075.0	c_000000000002	3042861	3043935			Function unknown	Uncharacterized membrane protein YcjF, UPF0283 family (YcjF)			KEGG Orthology (KO)>>>09190 Not Included in Pathway or Brite>>>09194 Poorly characterized>>>99996 General function prediction only			putative membrane protein							S	COG3768			ko00001			K08990					gene
3082.0	c_000000000002	3048178	3048499			Energy production and conversion	Ferredoxin (Fdx) (PDB:1KRH)			KEGG Orthology (KO)>>>09190 Not Included in Pathway or Brite>>>09191 Unclassified: metabolism>>>99982 Energy metabolism			ferredoxin, 2Fe-2S							C	COG0633			ko00001			K04755					gene
3083.0	c_000000000002	3048728	3049097			Signal transduction mechanisms	HPt (histidine-containing phosphotransfer) domain (HPtr) (PDB:3IQT)													T	COG2198											gene
3094.0	c_000000000002	3065647	3066856			Carbohydrate transport and metabolism	Sugar phosphate permease (UhpC) (PDB:1PW4)													G	COG2271											gene
3103.0	c_000000000002	3074115	3075504			Energy production and conversion	Dihydrolipoamide dehydrogenase (E3) component of pyruvate/2-oxoglutarate dehydrogenase complex or glutathione oxidoreductase (Lpd) (PDB:6QKG)	Glycine cleavagePyruvate oxidation	NADPH-glutathione reductase	KEGG Orthology (KO)>>>09100 Metabolism>>>09106 Metabolism of other amino acids>>>00480 Glutathione metabolism [PATH:ko00480]!!!Enzymes>>>1. Oxidoreductases>>>1.8  Acting on a sulfur group of donors>>>1.8.1  With NAD+ or NADP+ as acceptor>>>1.8.1.7  glutathione-disulfide reductase			glutathione reductase (NADPH) [EC:1.8.1.7]							C	COG1249	COG1249	CyCOG_60000717	ko00001!!!ko01000			K00383					gene
3104.0	c_000000000002	3075655	3076195			Function unknown	Uncharacterized conserved protein, contains DUF2059 domain (PDB:2X3O) (PUBMED:15741337)			KEGG Orthology (KO)>>>09190 Not Included in Pathway or Brite>>>09194 Poorly characterized>>>99997 Function unknown			uncharacterized protein							S	COG3184			ko00001			K09924					gene
3106.0	c_000000000002	3077108	3077789			Energy production and conversion	Phosphoglycolate phosphatase, HAD superfamily (Gph) (PDB:2NYV)		phosphoglycolate phosphatase	KEGG Orthology (KO)>>>09100 Metabolism>>>09101 Carbohydrate metabolism>>>00630 Glyoxylate and dicarboxylate metabolism [PATH:ko00630]!!!Enzymes>>>3. Hydrolases>>>3.1  Acting on ester bonds>>>3.1.3  Phosphoric-monoester hydrolases>>>3.1.3.18  phosphoglycolate phosphatase			phosphoglycolate phosphatase [EC:3.1.3.18]							C	COG0546		CyCOG_60014889	ko00001!!!ko01000			K01091					gene
3111.0	c_000000000002	3082288	3084217			Cell wall/membrane/envelope biogenesis	Murein L,D-transpeptidase YcbB/YkuD (YcbB) (PDB:6NTW) (PUBMED:18456808)			Peptidases and inhibitors>>>Cysteine peptidases>>>Family C82!!!Peptidoglycan biosynthesis and degradation proteins>>>Peptidoglycan biosynthesis and degradation>>>Transpeptidase			L,D-transpeptidase YcbB							M	COG2989			ko01002!!!ko01011			K21470					gene
3112.0	c_000000000002	3084511	3086119			Energy production and conversion!!!Energy production and conversion	Tartrate dehydratase beta subunit/Fumarate hydratase class I, C-terminal domain (FumA) (PDB:5L2R)!!!Tartrate dehydratase alpha subunit/Fumarate hydratase class I, N-terminal domain (TtdA) (PDB:5L2R) (PUBMED:15613473)	TCA cycle!!!TCA cycle		KEGG Orthology (KO)>>>09100 Metabolism>>>09101 Carbohydrate metabolism>>>00020 Citrate cycle (TCA cycle) [PATH:ko00020]!!!KEGG Orthology (KO)>>>09100 Metabolism>>>09101 Carbohydrate metabolism>>>00620 Pyruvate metabolism [PATH:ko00620]!!!KEGG Orthology (KO)>>>09100 Metabolism>>>09102 Energy metabolism>>>00720 Carbon fixation pathways in prokaryotes [PATH:ko00720]!!!Enzymes>>>4. Lyases>>>4.2  Carbon-oxygen lyases>>>4.2.1  Hydro-lyases>>>4.2.1.2  fumarate hydratase	Pathway modules; Carbohydrate metabolism; Central carbohydrate metabolism!!!Pathway modules; Carbohydrate metabolism; Central carbohydrate metabolism!!!Pathway modules; Energy metabolism; Carbon fixation!!!Signature modules; Module set; Metabolic capacity!!!Signature modules; Module set; Metabolic capacity	Citrate cycle (TCA cycle, Krebs cycle)!!!Citrate cycle, second carbon oxidation, 2-oxoglutarate => oxaloacetate!!!Reductive citrate cycle (Arnon-Buchanan cycle)!!!Anoxygenic photosynthesis in green nonsulfur bacteria!!!Anoxygenic photosynthesis in green sulfur bacteria	fumarate hydratase, class I [EC:4.2.1.2]							C!!!C	COG1838!!!COG1951	COG1838!!!COG1951		ko00001!!!ko00001!!!ko00001!!!ko01000	M00009!!!M00011!!!M00173!!!M00613!!!M00614	M00009!!!M00011!!!M00173!!!M00613!!!M00614	K01676					gene
3120.0	c_000000000002	3092099	3093071			Carbohydrate transport and metabolism!!!Amino acid transport and metabolism!!!General function prediction only	Permease of the drug/metabolite transporter (DMT) superfamily (RhaT) (PDB:5I20)		Permease of the drug/metabolite transporter (DMT) superfamily	Transporters>>>Other transporters>>>Electrochemical potential-driven transporters [TC:2]			S-adenosylmethionine uptake transporter							G!!!E!!!R	COG0697		CyCOG_60001143	ko02000			K15270					gene
3132.0	c_000000000002	3104236	3104725			Transcription	DNA-binding transcriptional regulator, Lrp family (Lrp) (PDB:1I1G)			Transcription factors>>>Prokaryotic type>>>Helix-turn-helix>>>Lrp/AsnC family			Lrp/AsnC family transcriptional regulator, cysteine-sensing transcriptional activator							K	COG1522			ko03000			K05800					gene
3133.0	c_000000000002	3104823	3105465			Replication, recombination and repair	Uracil-DNA glycosylase (Udg4) (PDB:3IKB)			KEGG Orthology (KO)>>>09120 Genetic Information Processing>>>09124 Replication and repair>>>03410 Base excision repair [PATH:ko03410]!!!Enzymes>>>3. Hydrolases>>>3.2  Glycosylases>>>3.2.2  Hydrolysing N-glycosyl compounds>>>3.2.2.27  uracil-DNA glycosylase!!!DNA repair and recombination proteins>>>Prokaryotic type>>>SSBR (single strand breaks repair)>>>BER (base exicision repair)>>>DNA glycosylases			uracil-DNA glycosylase [EC:3.2.2.27]							L	COG1573			ko00001!!!ko01000!!!ko03400			K21929					gene
3147.0	c_000000000002	3117691	3118384			Function unknown	Uncharacterized protein, contains RES domain (RES)													S	COG5654											gene
3152.0	c_000000000002	3121498	3121876			Transcription	DNA-binding transcriptional regulator ModE (molybdenum-dependent) (ModE) (PDB:1B9M) (PUBMED:19779461)			Transcription factors>>>Prokaryotic type>>>Helix-turn-helix>>>Other families			molybdate transport system regulatory protein							K	COG2005			ko03000			K02019					gene
3153.0	c_000000000002	3121946	3123032			Carbohydrate transport and metabolism	ABC-type sugar transport system, ATPase component MalK (MalK) (PDB:2ONK)		iron(III) transport system ATP-binding protein	KEGG Orthology (KO)>>>09130 Environmental Information Processing>>>09131 Membrane transport>>>02010 ABC transporters [PATH:ko02010]!!!Transporters>>>ABC transporters, prokaryotic type>>>Saccharide, polyol, and lipid transporters>>>Alpha-glucoside transporter			alpha-glucoside transport system ATP-binding protein							G	COG3839		CyCOG_60000065	ko00001!!!ko02000			K10235					gene
3156.0	c_000000000002	3124942	3126205			Carbohydrate transport and metabolism	ABC-type glycerol-3-phosphate transport system, periplasmic component (UgpB) (PDB:2Z8D)		carbohydrate ABC transporter substrate-binding protein, CUT1 family	KEGG Orthology (KO)>>>09130 Environmental Information Processing>>>09131 Membrane transport>>>02010 ABC transporters [PATH:ko02010]!!!Transporters>>>ABC transporters, prokaryotic type>>>Saccharide, polyol, and lipid transporters>>>Trehalose/maltose transporter			trehalose/maltose transport system substrate-binding protein							G	COG1653		CyCOG_60001961	ko00001!!!ko02000			K10236					gene
3157.0	c_000000000002	3126627	3128130			Lipid transport and metabolism	Acyl-CoA reductase or other NAD-dependent aldehyde dehydrogenase (AdhE) (PDB:1A4S)	Proline degradation	aldehyde dehydrogenase (NAD+)	KEGG Orthology (KO)>>>09100 Metabolism>>>09101 Carbohydrate metabolism>>>00640 Propanoate metabolism [PATH:ko00640]!!!KEGG Orthology (KO)>>>09100 Metabolism>>>09101 Carbohydrate metabolism>>>00562 Inositol phosphate metabolism [PATH:ko00562]!!!KEGG Orthology (KO)>>>09100 Metabolism>>>09105 Amino acid metabolism>>>00280 Valine, leucine and isoleucine degradation [PATH:ko00280]!!!KEGG Orthology (KO)>>>09100 Metabolism>>>09106 Metabolism of other amino acids>>>00410 beta-Alanine metabolism [PATH:ko00410]!!!Enzymes>>>1. Oxidoreductases>>>1.2  Acting on the aldehyde or oxo group of donors>>>1.2.1  With NAD+ or NADP+ as acceptor>>>1.2.1.18  malonate-semialdehyde dehydrogenase (acetylating)!!!Enzymes>>>1. Oxidoreductases>>>1.2  Acting on the aldehyde or oxo group of donors>>>1.2.1  With NAD+ or NADP+ as acceptor>>>1.2.1.27  methylmalonate-semialdehyde dehydrogenase (CoA-acylating)	Pathway modules; Carbohydrate metabolism; Other carbohydrate metabolism	Malonate semialdehyde pathway, propanoyl-CoA => acetyl-CoA	malonate-semialdehyde dehydrogenase (acetylating) / methylmalonate-semialdehyde dehydrogenase [EC:1.2.1.18 1.2.1.27]							I	COG1012	COG1012	CyCOG_60010279	ko00001!!!ko00001!!!ko00001!!!ko00001!!!ko01000!!!ko01000	M00013	M00013	K00140					gene
3158.0	c_000000000002	3128160	3129048			Nucleotide transport and metabolism	Formyltetrahydrofolate hydrolase (PurU) (PDB:3O1L)	Purine biosynthesis	formyltetrahydrofolate deformylase	KEGG Orthology (KO)>>>09100 Metabolism>>>09101 Carbohydrate metabolism>>>00630 Glyoxylate and dicarboxylate metabolism [PATH:ko00630]!!!KEGG Orthology (KO)>>>09100 Metabolism>>>09108 Metabolism of cofactors and vitamins>>>00670 One carbon pool by folate [PATH:ko00670]!!!Enzymes>>>3. Hydrolases>>>3.5  Acting on carbon-nitrogen bonds, other than peptide bonds>>>3.5.1  In linear amides>>>3.5.1.10  formyltetrahydrofolate deformylase			formyltetrahydrofolate deformylase [EC:3.5.1.10]							F	COG0788	COG0788	CyCOG_60000678	ko00001!!!ko00001!!!ko01000			K01433					gene
3159.0	c_000000000002	3129174	3130230			Amino acid transport and metabolism	Histidinol-phosphate/aromatic aminotransferase or cobyric acid decarboxylase (HisC) (PDB:4R2N)	Cobalamine/B12 biosynthesis	histidinol-phosphate aminotransferase	KEGG Orthology (KO)>>>09100 Metabolism>>>09105 Amino acid metabolism>>>00340 Histidine metabolism [PATH:ko00340]!!!KEGG Orthology (KO)>>>09100 Metabolism>>>09105 Amino acid metabolism>>>00350 Tyrosine metabolism [PATH:ko00350]!!!KEGG Orthology (KO)>>>09100 Metabolism>>>09105 Amino acid metabolism>>>00360 Phenylalanine metabolism [PATH:ko00360]!!!KEGG Orthology (KO)>>>09100 Metabolism>>>09105 Amino acid metabolism>>>00400 Phenylalanine, tyrosine and tryptophan biosynthesis [PATH:ko00400]!!!KEGG Orthology (KO)>>>09100 Metabolism>>>09110 Biosynthesis of other secondary metabolites>>>00960 Tropane, piperidine and pyridine alkaloid biosynthesis [PATH:ko00960]!!!KEGG Orthology (KO)>>>09100 Metabolism>>>09110 Biosynthesis of other secondary metabolites>>>00401 Novobiocin biosynthesis [PATH:ko00401]!!!Enzymes>>>2. Transferases>>>2.6  Transferring nitrogenous groups>>>2.6.1  Transaminases>>>2.6.1.9  histidinol-phosphate transaminase!!!Amino acid related enzymes>>>Aminotransferase (transaminase)>>>Class II	Pathway modules; Amino acid metabolism; Histidine metabolism	Histidine biosynthesis, PRPP => histidine	histidinol-phosphate aminotransferase [EC:2.6.1.9]							E	COG0079	COG0079	CyCOG_60000156	ko00001!!!ko00001!!!ko00001!!!ko00001!!!ko00001!!!ko00001!!!ko01000!!!ko01007	M00026	M00026	K00817					gene
3169.0	c_000000000002	3141089	3142034			Amino acid transport and metabolism!!!Inorganic ion transport and metabolism	ABC-type dipeptide/oligopeptide/nickel transport system, permease component (DppB)		peptide/nickel transport system permease protein	KEGG Orthology (KO)>>>09140 Cellular Processes>>>09145 Cellular community - prokaryotes>>>02024 Quorum sensing [PATH:ko02024]!!!Transporters>>>ABC transporters, prokaryotic type>>>Peptide and nickel transporters>>>Peptides/nickel transporter			peptide/nickel transport system permease protein							E!!!P	COG0601		CyCOG_60000828	ko00001!!!ko02000			K02033					gene
3170.0	c_000000000002	3142112	3143672			Amino acid transport and metabolism	ABC-type transport system, periplasmic component (DdpA) (PDB:3RQT)		peptide/nickel transport system substrate-binding protein	KEGG Orthology (KO)>>>09140 Cellular Processes>>>09145 Cellular community - prokaryotes>>>02024 Quorum sensing [PATH:ko02024]!!!Transporters>>>ABC transporters, prokaryotic type>>>Peptide and nickel transporters>>>Peptides/nickel transporter			peptide/nickel transport system substrate-binding protein							E	COG0747		CyCOG_60000682	ko00001!!!ko02000			K02035					gene
3171.0	c_000000000002	3143795	3145079			Amino acid transport and metabolism	Acetylornithine deacetylase/Succinyl-diaminopimelate desuccinylase or related deacylase (ArgE) (PDB:1CG2)	Arginine biosynthesis	N-carbamoyl-L-amino-acid hydrolase											E	COG0624	COG0624	CyCOG_60002952									gene
3194.0	c_000000000002	3167522	3168479			General function prediction only	TRAP-type uncharacterized transport system, periplasmic component (Imp) (PDB:1US4)			KEGG Orthology (KO)>>>09190 Not Included in Pathway or Brite>>>09194 Poorly characterized>>>99997 Function unknown			uncharacterized protein							R	COG2358			ko00001			K07080					gene
3195.0	c_000000000002	3168673	3170248			Nucleotide transport and metabolism!!!Defense mechanisms	2',3'-cyclic-nucleotide 2'-phosphodiesterase/5'- or 3'-nucleotidase, 5'-nucleotidase family (UshA) (PDB:1HO5)		2',3'-cyclic-nucleotide 2'-phosphodiesterase/5'- or 3'-nucleotidase, 5'-nucleotidase family	KEGG Orthology (KO)>>>09100 Metabolism>>>09104 Nucleotide metabolism>>>00230 Purine metabolism [PATH:ko00230]!!!KEGG Orthology (KO)>>>09100 Metabolism>>>09104 Nucleotide metabolism>>>00240 Pyrimidine metabolism [PATH:ko00240]!!!KEGG Orthology (KO)>>>09100 Metabolism>>>09108 Metabolism of cofactors and vitamins>>>00760 Nicotinate and nicotinamide metabolism [PATH:ko00760]!!!Enzymes>>>3. Hydrolases>>>3.1  Acting on ester bonds>>>3.1.3  Phosphoric-monoester hydrolases>>>3.1.3.5  5'-nucleotidase	Pathway modules; Nucleotide metabolism; Purine metabolism!!!Pathway modules; Nucleotide metabolism; Purine metabolism	Adenine ribonucleotide degradation, AMP => Urate!!!Guanine ribonucleotide degradation, GMP => Urate	5'-nucleotidase [EC:3.1.3.5]							F!!!V	COG0737		CyCOG_60006976	ko00001!!!ko00001!!!ko00001!!!ko01000	M00958!!!M00959	M00958!!!M00959	K01081					gene
3196.0	c_000000000002	3170358	3170925			Transcription	DNA-binding protein, AcrR family, includes nucleoid occlusion protein SlmA (AcrR) (PDB:2QOP)			Transcription factors>>>Prokaryotic type>>>Helix-turn-helix>>>TetR/AcrR family			TetR/AcrR family transcriptional regulator, tetracycline repressor protein							K	COG1309			ko03000			K18476					gene
3197.0	c_000000000002	3171003	3171867			General function prediction only	Short-chain dehydrogenase (YqjQ)		Short-chain dehydrogenase	KEGG Orthology (KO)>>>09100 Metabolism>>>09101 Carbohydrate metabolism>>>00650 Butanoate metabolism [PATH:ko00650]!!!Enzymes>>>1. Oxidoreductases>>>1.1  Acting on the CH-OH group of donors>>>1.1.1  With NAD+ or NADP+ as acceptor>>>1.1.1.30  3-hydroxybutyrate dehydrogenase	Pathway modules; Lipid metabolism; Lipid metabolism	Ketone body biosynthesis, acetyl-CoA => acetoacetate/3-hydroxybutyrate/acetone	3-hydroxybutyrate dehydrogenase [EC:1.1.1.30]							R	COG0300		CyCOG_60004441	ko00001!!!ko01000	M00088	M00088	K00019					gene
3198.0	c_000000000002	3171949	3172879			Amino acid transport and metabolism	Ornithine cyclodeaminase/archaeal alanine dehydrogenase, mu-crystallin family (OCDMu) (PDB:2I99)	Proline biosynthesis												E	COG2423	COG2423										gene
3199.0	c_000000000002	3173062	3173659			Amino acid transport and metabolism	N-acetylglutamate synthase or related acetyltransferase, GNAT family (ArgA) (PDB:2R98)	Arginine biosynthesis												E	COG1246	COG1246										gene
3201.0	c_000000000002	3175217	3176255			Transcription	AraC-type DNA-binding domain and AraC-containing proteins (AraC) (PDB:1BL0)													K	COG2207											gene
3202.0	c_000000000002	3176524	3176800			Signal transduction mechanisms!!!Transcription	DNA-binding response regulator, NarL/FixJ family, contains REC and HTH domains (CitB) (PDB:1A04)													T!!!K	COG2197											gene
3213.0	c_000000000002	3187242	3188850			Energy production and conversion	Cbb3-type cytochrome oxidase, subunit 1 (CcoN) (PDB:3MK7)		cytochrome c oxidase subunit 1	KEGG Orthology (KO)>>>09100 Metabolism>>>09102 Energy metabolism>>>00190 Oxidative phosphorylation [PATH:ko00190]!!!KEGG Orthology (KO)>>>09130 Environmental Information Processing>>>09132 Signal transduction>>>02020 Two-component system [PATH:ko02020]!!!Enzymes>>>7. Translocases>>>7.1  Catalysing the translocation of protons>>>7.1.1  Linked to oxidoreductase reactions>>>7.1.1.9  cytochrome-c oxidase	Pathway modules; Energy metabolism; ATP synthesis	Cytochrome c oxidase, cbb3-type	cytochrome c oxidase cbb3-type subunit I [EC:7.1.1.9]							C	COG3278		CyCOG_60000041	ko00001!!!ko00001!!!ko01000	M00156	M00156	K00404					gene
3215.0	c_000000000002	3189778	3191308			Replication, recombination and repair	Replicative DNA helicase (DnaB) (PDB:1B79)		primary replicative DNA helicase	KEGG Orthology (KO)>>>09120 Genetic Information Processing>>>09124 Replication and repair>>>03030 DNA replication [PATH:ko03030]!!!KEGG Orthology (KO)>>>09140 Cellular Processes>>>09143 Cell growth and death>>>04112 Cell cycle - Caulobacter [PATH:ko04112]!!!Enzymes>>>5. Isomerases>>>5.6  Isomerases altering macromolecular conformation>>>5.6.2  Enzymes altering nucleic acid conformation>>>5.6.2.3  DNA 5'-3' helicase!!!DNA replication proteins>>>Prokaryotic type>>>DNA Replication Initiation Factors>>>Initiation factors (bacterial)			replicative DNA helicase [EC:5.6.2.3]							L	COG0305		CyCOG_60000112	ko00001!!!ko00001!!!ko01000!!!ko03032			K02314					gene
3216.0	c_000000000002	3191498	3192296			Amino acid transport and metabolism!!!Signal transduction mechanisms	ABC-type amino acid transport/signal transduction system, periplasmic component/domain (HisJ) (PDB:1GGG)		amino acid ABC transporter substrate-binding protein, PAAT family	Transporters>>>ABC transporters, prokaryotic type>>>Phosphate and amino acid transporters>>>Putative polar amino acid transporter			polar amino acid transport system substrate-binding protein							E!!!T	COG0834		CyCOG_60014702	ko02000			K02030					gene
