2188.0	c_000000000001	2276832	2277348			Amino acid transport and metabolism	Acetolactate synthase, small subunit (IlvH) (PDB:2F1F)	Isoleucine, leucine, valine biosynthesis	acetolactate synthase, small subunit	KEGG Orthology (KO)>>>09100 Metabolism>>>09101 Carbohydrate metabolism>>>00650 Butanoate metabolism [PATH:ko00650]!!!KEGG Orthology (KO)>>>09100 Metabolism>>>09101 Carbohydrate metabolism>>>00660 C5-Branched dibasic acid metabolism [PATH:ko00660]!!!KEGG Orthology (KO)>>>09100 Metabolism>>>09105 Amino acid metabolism>>>00290 Valine, leucine and isoleucine biosynthesis [PATH:ko00290]!!!KEGG Orthology (KO)>>>09100 Metabolism>>>09108 Metabolism of cofactors and vitamins>>>00770 Pantothenate and CoA biosynthesis [PATH:ko00770]!!!Enzymes>>>2. Transferases>>>2.2  Transferring aldehyde or ketonic groups>>>2.2.1  Transketolases and transaldolases>>>2.2.1.6  acetolactate synthase	Pathway modules; Amino acid metabolism; Branched-chain amino acid metabolism!!!Pathway modules; Amino acid metabolism; Branched-chain amino acid metabolism	Valine/isoleucine biosynthesis, pyruvate => valine / 2-oxobutanoate => isoleucine!!!Isoleucine biosynthesis, threonine => 2-oxobutanoate => isoleucine	acetolactate synthase I/III small subunit [EC:2.2.1.6]							E	COG0440	COG0440	CyCOG_60001031	ko00001!!!ko00001!!!ko00001!!!ko00001!!!ko01000	M00019!!!M00570	M00019!!!M00570	K01653					gene
2194.0	c_000000000001	2282248	2282920			Energy production and conversion	Nitroreductase (NfnB) (PDB:1F5V)	Pyrimidine degradation		Enzymes>>>1. Oxidoreductases>>>1.21  Catalysing the reaction X-H + Y-H = X-Y>>>1.21.1  With NAD+ or NADP+ as acceptor>>>1.21.1.1  iodotyrosine deiodinase			iodotyrosine deiodinase [EC:1.21.1.1]							C	COG0778	COG0778		ko01000			K17231					gene
2204.0	c_000000000001	2290247	2290847			Transcription	DNA-binding protein, AcrR family, includes nucleoid occlusion protein SlmA (AcrR) (PDB:2QOP)													K	COG1309											gene
2205.0	c_000000000001	2290892	2292323			Secondary metabolites biosynthesis, transport and catabolism	Carotenoid cleavage dioxygenase or a related enzyme (PDB:2BIW)		Lignostilbene-alpha,beta-dioxygenase and related enzymes	KEGG Orthology (KO)>>>09190 Not Included in Pathway or Brite>>>09191 Unclassified: metabolism>>>99980 Enzymes with EC numbers!!!Enzymes>>>1. Oxidoreductases>>>1.13  Acting on single donors with incorporation of molecular oxygen (oxygenases)>>>1.13.11  With incorporation of two atoms of oxygen>>>1.13.11.82  8'-apo-carotenoid 13,14-cleaving dioxygenase			8'-apo-carotenoid 13,14-cleaving dioxygenase [EC:1.13.11.82]							Q	COG3670		CyCOG_60028937	ko00001!!!ko01000			K21822					gene
2214.0	c_000000000001	2298847	2299168			Transcription	Transcriptional regulator NrdR, contains Zn-ribbon and ATP-cone domains (NrdR)		transcriptional repressor NrdR	Transcription factors>>>Prokaryotic type>>>Other transcription factors>>>Others			transcriptional repressor NrdR							K	COG1327		CyCOG_60000566	ko03000			K07738					gene
2222.0	c_000000000001	2305357	2307214			Replication, recombination and repair	DNA primase (bacterial type) (DnaG) (PDB:3B39) (PUBMED:28128549)		DNA primase	KEGG Orthology (KO)>>>09120 Genetic Information Processing>>>09124 Replication and repair>>>03030 DNA replication [PATH:ko03030]!!!Enzymes>>>2. Transferases>>>2.7  Transferring phosphorus-containing groups>>>2.7.7  Nucleotidyltransferases>>>2.7.7.101  DNA primase DnaG!!!DNA replication proteins>>>Prokaryotic type>>>DNA Replication Initiation Factors>>>Initiation factors (bacterial)			DNA primase [EC:2.7.7.101]							L	COG0358		CyCOG_60000892	ko00001!!!ko01000!!!ko03032			K02316					gene
2226.0	c_000000000001	2309297	2310476			Amino acid transport and metabolism!!!Nucleotide transport and metabolism	Carbamoylphosphate synthase small subunit (CarA) (PDB:1C30)	Arginine biosynthesis	carbamoyl-phosphate synthase small subunit	KEGG Orthology (KO)>>>09100 Metabolism>>>09104 Nucleotide metabolism>>>00240 Pyrimidine metabolism [PATH:ko00240]!!!KEGG Orthology (KO)>>>09100 Metabolism>>>09105 Amino acid metabolism>>>00250 Alanine, aspartate and glutamate metabolism [PATH:ko00250]!!!Enzymes>>>6. Ligases>>>6.3  Forming carbon-nitrogen bonds>>>6.3.5  Carbon-nitrogen ligases with glutamine as amido-N-donor>>>6.3.5.5  carbamoyl-phosphate synthase (glutamine-hydrolysing)	Pathway modules; Nucleotide metabolism; Pyrimidine metabolism	De novo pyrimidine biosynthesis, glutamine (+ PRPP) => UMP	carbamoyl-phosphate synthase small subunit [EC:6.3.5.5]							E!!!F	COG0505	COG0505	CyCOG_60001170	ko00001!!!ko00001!!!ko01000	M00051	M00051	K01956					gene
2231.0	c_000000000001	2315592	2315823			Carbohydrate transport and metabolism	Archaeal fructose-1,6-bisphosphatase or related enzyme, inositol monophosphatase family (SuhB) (PDB:1AWB)	Gluconeogenesis												G	COG0483	COG0483										gene
2238.0	c_000000000001	2319703	2320756			General function prediction only	Predicted  kinase, aminoglycoside phosphotransferase (APT) family (YcbJ)		Ecdysteroid kinase											R	COG3173		CyCOG_60006275									gene
2241.0	c_000000000001	2322271	2323516			Coenzyme transport and metabolism!!!Coenzyme transport and metabolism	3,4-dihydroxy-2-butanone 4-phosphate synthase (RibB) (PDB:1G57)!!!GTP cyclohydrolase II (RibA) (PDB:2BZ0)	Riboflavin/FAD biosynthesis!!!Riboflavin/FAD biosynthesis	3,4-dihydroxy-2-butanone 4-phosphate synthase /GTP cyclohydrolase II	KEGG Orthology (KO)>>>09100 Metabolism>>>09108 Metabolism of cofactors and vitamins>>>00740 Riboflavin metabolism [PATH:ko00740]!!!KEGG Orthology (KO)>>>09100 Metabolism>>>09108 Metabolism of cofactors and vitamins>>>00790 Folate biosynthesis [PATH:ko00790]!!!Enzymes>>>3. Hydrolases>>>3.5  Acting on carbon-nitrogen bonds, other than peptide bonds>>>3.5.4  In cyclic amidines>>>3.5.4.25  GTP cyclohydrolase II!!!Enzymes>>>4. Lyases>>>4.1  Carbon-carbon lyases>>>4.1.99  Other carbon-carbon lyases>>>4.1.99.12  3,4-dihydroxy-2-butanone-4-phosphate synthase	Pathway modules; Metabolism of cofactors and vitamins; Cofactor and vitamin metabolism!!!Pathway modules; Metabolism of cofactors and vitamins; Cofactor and vitamin metabolism	Riboflavin biosynthesis, plants and bacteria, GTP => riboflavin/FMN/FAD!!!Tetrahydrofolate biosynthesis, mediated by ribA and trpF, GTP => THF	3,4-dihydroxy 2-butanone 4-phosphate synthase / GTP cyclohydrolase II [EC:4.1.99.12 3.5.4.25]							H!!!H	COG0108!!!COG0807	COG0108!!!COG0807	CyCOG_60001005	ko00001!!!ko00001!!!ko01000!!!ko01000	M00125!!!M00840	M00125!!!M00840	K14652					gene
2248.0	c_000000000001	2329669	2330713			Cell cycle control, cell division, chromosome partitioning!!!Cytoskeleton	Cell shape-determining ATPase MreB, actin-like superfamily (MreB) (PDB:1JCE)		rod shape-determining protein MreB	Chromosome and associated proteins>>>Prokaryotic type>>>Chromosome partitioning proteins>>>Other chromosome partitioning proteins!!!Cytoskeleton proteins>>>Prokaryotic cytoskeleton proteins>>>Actin homologs>>>Actins!!!Prokaryotic defense system>>>Toxin-antitoxin system (TA system)>>>Type II TA system>>>Type II TA system related factors			rod shape-determining protein MreB and related proteins							D!!!Z	COG1077		CyCOG_60000234	ko03036!!!ko04812!!!ko02048			K03569					gene
2249.0	c_000000000001	2330907	2332710			Replication, recombination and repair	DNA mismatch repair ATPase MutL (MutL) (PDB:1B62)			KEGG Orthology (KO)>>>09120 Genetic Information Processing>>>09124 Replication and repair>>>03430 Mismatch repair [PATH:ko03430]!!!DNA repair and recombination proteins>>>Prokaryotic type>>>SSBR (single strand breaks repair)>>>MMR (mismatch excision repair)>>>Molecular matchmaker			DNA mismatch repair protein MutL							L	COG0323			ko00001!!!ko03400			K03572					gene
2251.0	c_000000000001	2333199	2333658			Lipid transport and metabolism	Acyl-CoA dehydratase PaaZ (MaoC) (PDB:5ZY8)													I	COG2030											gene
2255.0	c_000000000001	2337091	2338087			General function prediction only	Short-chain dehydrogenase (YqjQ)		Short-chain dehydrogenase	KEGG Orthology (KO)>>>09100 Metabolism>>>09101 Carbohydrate metabolism>>>00650 Butanoate metabolism [PATH:ko00650]!!!Enzymes>>>1. Oxidoreductases>>>1.1  Acting on the CH-OH group of donors>>>1.1.1  With NAD+ or NADP+ as acceptor>>>1.1.1.30  3-hydroxybutyrate dehydrogenase	Pathway modules; Lipid metabolism; Lipid metabolism	Ketone body biosynthesis, acetyl-CoA => acetoacetate/3-hydroxybutyrate/acetone	3-hydroxybutyrate dehydrogenase [EC:1.1.1.30]							R	COG0300		CyCOG_60004441	ko00001!!!ko01000	M00088	M00088	K00019					gene
2260.0	c_000000000001	2340936	2341872			Function unknown	Uncharacterized conserved protein YbaP, TraB family (TraB)			KEGG Orthology (KO)>>>09190 Not Included in Pathway or Brite>>>09194 Poorly characterized>>>99997 Function unknown			uncharacterized protein							S	COG3735			ko00001			K09973					gene
2261.0	c_000000000001	2342013	2342913			Translation, ribosomal structure and biogenesis	Glycyl-tRNA synthetase, alpha subunit (GlyQ) (PDB:1J5W)	Aminoacyl-tRNA synthetases	glycyl-tRNA synthetase alpha chain	KEGG Orthology (KO)>>>09120 Genetic Information Processing>>>09122 Translation>>>00970 Aminoacyl-tRNA biosynthesis [PATH:ko00970]!!!Enzymes>>>6. Ligases>>>6.1  Forming carbon-oxygen bonds>>>6.1.1  Ligases forming aminoacyl-tRNA and related compounds>>>6.1.1.14  glycine---tRNA ligase!!!Amino acid related enzymes>>>Aminoacyl-tRNA synthetase>>>Class II (C/G)!!!Transfer RNA biogenesis>>>Prokaryotic type>>>Aminoacyl-tRNA synthetases (AARSs)>>>Other AARSs			glycyl-tRNA synthetase alpha chain [EC:6.1.1.14]							J	COG0752	COG0752	CyCOG_60000962	ko00001!!!ko01000!!!ko01007!!!ko03016			K01878					gene
2279.0	c_000000000001	2362071	2363256			Function unknown	Uncharacterized CoxE-like protein,  contains von Willebrand factor type A (vWA) domain (CoxE2)		VWA containing CoxE family protein	KEGG Orthology (KO)>>>09190 Not Included in Pathway or Brite>>>09194 Poorly characterized>>>99997 Function unknown			uncharacterized protein							S	COG3825		CyCOG_60015434	ko00001			K09989					gene
2280.0	c_000000000001	2363380	2364781			Signal transduction mechanisms	Methyl-accepting chemotaxis protein (MCP) (Tar) (PDB:1QU7)		Methyl-accepting chemotaxis protein	KEGG Orthology (KO)>>>09130 Environmental Information Processing>>>09132 Signal transduction>>>02020 Two-component system [PATH:ko02020]!!!KEGG Orthology (KO)>>>09140 Cellular Processes>>>09142 Cell motility>>>02030 Bacterial chemotaxis [PATH:ko02030]!!!Bacterial motility proteins>>>Flagellar system>>>Chemotaxis proteins>>>MCPs			methyl-accepting chemotaxis protein							T	COG0840		CyCOG_60013478	ko00001!!!ko00001!!!ko02035			K03406					gene
2293.0	c_000000000001	2376522	2377239			Translation, ribosomal structure and biogenesis	Ribonuclease PH (Rph) (PDB:1UDO)		RNAse PH	Enzymes>>>2. Transferases>>>2.7  Transferring phosphorus-containing groups>>>2.7.7  Nucleotidyltransferases>>>2.7.7.56  tRNA nucleotidyltransferase!!!Transfer RNA biogenesis>>>Prokaryotic type>>>3'processing and CCA adding factors>>>3'processing factors			ribonuclease PH [EC:2.7.7.56]							J	COG0689		CyCOG_60001952	ko01000!!!ko03016			K00989					gene
2294.0	c_000000000001	2377323	2378367			Transcription	Transcriptional regulator of heat shock response (HrcA) (PDB:1STZ)		heat-inducible transcription repressor HrcA	Transcription factors>>>Prokaryotic type>>>Other transcription factors>>>Others			heat-inducible transcriptional repressor							K	COG1420		CyCOG_60001997	ko03000			K03705					gene
2317.0	c_000000000001	2403228	2405088			Inorganic ion transport and metabolism!!!Inorganic ion transport and metabolism	Kef-type K+ transport system, membrane component KefB (KefB) (PDB:4BWZ)!!!Voltage-gated potassium channel Kch (Kch) (PDB:3FWZ)		Kef-type potassium/proton antiporter, CPA2 family (TC 2.A.37.1)	Transporters>>>Other transporters>>>Electrochemical potential-driven transporters [TC:2]			glutathione-regulated potassium-efflux system protein KefB							P!!!P	COG0475!!!COG1226		CyCOG_60029087	ko02000			K11747					gene
2326.0	c_000000000001	2416513	2417713			Cell wall/membrane/envelope biogenesis	Outer membrane protein TolC (TolC) (PDB:1EK9)			Transporters>>>ABC transporters, prokaryotic type>>>ABC-2 type and other transporters>>>Pyoluteorin transporter			outer membrane protein, heavy metal efflux system							M	COG1538			ko02000			K15725					gene
2329.0	c_000000000001	2419472	2422643			Inorganic ion transport and metabolism	Cu/Ag efflux pump CusA (CusA) (PDB:3K07)		cation efflux system protein involved in nickel and cobalt tolerance	Transporters>>>Other transporters>>>Electrochemical potential-driven transporters [TC:2]			heavy metal efflux system protein							P	COG3696		CyCOG_60003866	ko02000			K15726					gene
2331.0	c_000000000001	2423015	2424326			Inorganic ion transport and metabolism	Chromate transport protein ChrA (ChrA)		chromate transporter	Transporters>>>Other transporters>>>Electrochemical potential-driven transporters [TC:2]			chromate transporter							P	COG2059		CyCOG_60003206	ko02000			K07240					gene
2335.0	c_000000000001	2427350	2428646			Replication, recombination and repair!!!Mobilome: prophages, transposons	Integrase/recombinase, includes phage integrase (FimB)		prophage CP4-like integrase											L!!!X	COG0582		CyCOG_60014423									gene
2336.0	c_000000000001	2429213	2430236			Cell wall/membrane/envelope biogenesis	Membrane-bound lytic murein transglycosylase B (MltB) (PDB:1D0K)			Enzymes>>>4. Lyases>>>4.2  Carbon-oxygen lyases>>>4.2.2  Acting on polysaccharides>>>4.2.2.-!!!Peptidoglycan biosynthesis and degradation proteins>>>Peptidoglycan biosynthesis and degradation>>>Lytic transglycosylase			membrane-bound lytic murein transglycosylase B [EC:4.2.2.-]							M	COG2951			ko01000!!!ko01011			K08305					gene
2361.0	c_000000000001	2454263	2457101			Replication, recombination and repair	DNA gyrase/topoisomerase IV, subunit A (GyrA) (PDB:1SUU)		DNA gyrase subunit A	Enzymes>>>5. Isomerases>>>5.6  Isomerases altering macromolecular conformation>>>5.6.2  Enzymes altering nucleic acid conformation>>>5.6.2.2  DNA topoisomerase (ATP-hydrolysing)!!!DNA replication proteins>>>Prokaryotic type>>>DNA Topoisomerases!!!DNA repair and recombination proteins>>>Prokaryotic type>>>DSBR (double strand breaks repair)>>>NHEJ (non-homologous end-joining)>>>SHIIR (short-homology-independent illegitimate recombination)>>>Facilitator			DNA gyrase subunit A [EC:5.6.2.2]							L	COG0188		CyCOG_60000414	ko01000!!!ko03032!!!ko03400			K02469					gene
2362.0	c_000000000001	2457156	2457825			Function unknown	Uncharacterized membrane protein YhhN (YhhN)													S	COG3714											gene
2363.0	c_000000000001	2457878	2459246			Translation, ribosomal structure and biogenesis	Folate-dependent tRNA-U54 methylase TrmFO/GidA (TrmFO) (PUBMED:16027442)	tRNA modification	tRNA uridine 5-carboxymethylaminomethyl modification enzyme/methylenetetrahydrofolate--tRNA-(uracil-5-)-methyltransferase	Enzymes>>>2. Transferases>>>2.1  Transferring one-carbon groups>>>2.1.1  Methyltransferases>>>2.1.1.74  methylenetetrahydrofolate---tRNA-(uracil54-C5)-methyltransferase [NAD(P)H-oxidizing]!!!Transfer RNA biogenesis>>>Prokaryotic type>>>tRNA modification factors>>>Methyltransferases!!!Chromosome and associated proteins>>>Prokaryotic type>>>Chromosome partitioning proteins>>>Other chromosome partitioning proteins			methylenetetrahydrofolate--tRNA-(uracil-5-)-methyltransferase [EC:2.1.1.74]							J	COG1206	COG1206	CyCOG_60001132	ko01000!!!ko03016!!!ko03036			K04094					gene
2368.0	c_000000000001	2463008	2463326			Cell cycle control, cell division, chromosome partitioning	Cell division protein FtsB (FtsB) (PDB:4IFF)													D	COG2919											gene
2369.0	c_000000000001	2463495	2464617			Amino acid transport and metabolism!!!General function prediction only	4-hydroxyphenylpyruvate dioxygenase and related hemolysins (HppD)			KEGG Orthology (KO)>>>09100 Metabolism>>>09105 Amino acid metabolism>>>00350 Tyrosine metabolism [PATH:ko00350]!!!KEGG Orthology (KO)>>>09100 Metabolism>>>09105 Amino acid metabolism>>>00360 Phenylalanine metabolism [PATH:ko00360]!!!KEGG Orthology (KO)>>>09100 Metabolism>>>09108 Metabolism of cofactors and vitamins>>>00130 Ubiquinone and other terpenoid-quinone biosynthesis [PATH:ko00130]!!!Enzymes>>>1. Oxidoreductases>>>1.13  Acting on single donors with incorporation of molecular oxygen (oxygenases)>>>1.13.11  With incorporation of two atoms of oxygen>>>1.13.11.27  4-hydroxyphenylpyruvate dioxygenase!!!Exosome>>>Exosomal proteins>>>Exosomal proteins of other body fluids (saliva and urine)	Pathway modules; Amino acid metabolism; Aromatic amino acid metabolism	Tyrosine degradation, tyrosine => homogentisate	4-hydroxyphenylpyruvate dioxygenase [EC:1.13.11.27]							E!!!R	COG3185			ko00001!!!ko00001!!!ko00001!!!ko01000!!!ko04147	M00044	M00044	K00457					gene
2370.0	c_000000000001	2464613	2465186			Secondary metabolites biosynthesis, transport and catabolism	Catechol 2,3-dioxygenase or related enzyme, vicinal oxygen chelate (VOC) family (GloA) (PDB:3R4Q) (PUBMED:11830595)			KEGG Orthology (KO)>>>09100 Metabolism>>>09111 Xenobiotics biodegradation and metabolism>>>00361 Chlorocyclohexane and chlorobenzene degradation [PATH:ko00361]!!!KEGG Orthology (KO)>>>09100 Metabolism>>>09111 Xenobiotics biodegradation and metabolism>>>00621 Dioxin degradation [PATH:ko00621]!!!Enzymes>>>1. Oxidoreductases>>>1.13  Acting on single donors with incorporation of molecular oxygen (oxygenases)>>>1.13.11  With incorporation of two atoms of oxygen>>>1.13.11.39  biphenyl-2,3-diol 1,2-dioxygenase			glyoxylase I family protein							Q	COG0346			ko00001!!!ko00001!!!ko01000			K08234					gene
2371.0	c_000000000001	2465249	2466128			Cell wall/membrane/envelope biogenesis	Small-conductance mechanosensitive channel (MscS) (PDB:2OAU)		small conductance mechanosensitive channel	Transporters>>>Other transporters>>>Pores ion channels [TC:1]			small conductance mechanosensitive channel							M	COG0668		CyCOG_60016498	ko02000			K03442					gene
2372.0	c_000000000001	2466175	2467090			Coenzyme transport and metabolism!!!General function prediction only	2-succinyl-6-hydroxy-2,4-cyclohexadiene-1-carboxylate synthase MenH and related esterases, alpha/beta hydrolase fold (MenH) (PDB:4MYS)	Menaquinone biosynthesis	Pimeloyl-ACP methyl ester carboxylesterase	KEGG Orthology (KO)>>>09100 Metabolism>>>09111 Xenobiotics biodegradation and metabolism>>>00625 Chloroalkane and chloroalkene degradation [PATH:ko00625]!!!KEGG Orthology (KO)>>>09100 Metabolism>>>09111 Xenobiotics biodegradation and metabolism>>>00361 Chlorocyclohexane and chlorobenzene degradation [PATH:ko00361]!!!Enzymes>>>3. Hydrolases>>>3.8  Acting on halide bonds>>>3.8.1  In carbon-halide compounds>>>3.8.1.5  haloalkane dehalogenase			haloalkane dehalogenase [EC:3.8.1.5]							H!!!R	COG0596	COG0596	CyCOG_60000986	ko00001!!!ko00001!!!ko01000			K01563					gene
2385.0	c_000000000001	2478541	2479210			Cell wall/membrane/envelope biogenesis	Outer membrane protein OmpW (OmpW) (PDB:2F1T)			KEGG Orthology (KO)>>>09190 Not Included in Pathway or Brite>>>09193 Unclassified: signaling and cellular processes>>>99992 Structural proteins			outer membrane protein							M	COG3047			ko00001			K07275					gene
2392.0	c_000000000001	2486172	2486859			Signal transduction mechanisms!!!Transcription	DNA-binding response regulator, OmpR family, contains REC and winged-helix (wHTH) domain (OmpR) (PDB:1XHF)		two component transcriptional regulator, winged helix family	Protein kinases>>>Histidine kinases>>>Other!!!Two-component system>>>Other families>>>Unclassified			two-component system, OmpR family, response regulator							T!!!K	COG0745		CyCOG_60001922	ko01001!!!ko02022			K02483					gene
2396.0	c_000000000001	2490443	2491286							KEGG Orthology (KO)>>>09190 Not Included in Pathway or Brite>>>09194 Poorly characterized>>>99997 Function unknown			uncharacterized protein											ko00001			K07126					gene
2400.0	c_000000000001	2494158	2494422			Posttranslational modification, protein turnover, chaperones	Glutaredoxin (GrxC) (PDB:1AAZ)		glutaredoxin 3	Chaperones and folding catalysts>>>Protein folding catalysts>>>Protein disulfide isomerase			glutaredoxin 3							O	COG0695		CyCOG_60000419	ko03110			K03676					gene
2401.0	c_000000000001	2494587	2495067			Posttranslational modification, protein turnover, chaperones	Small heat shock protein IbpA, HSP20 family (IbpA) (PDB:1GME)		molecular chaperone IbpA	Chaperones and folding catalysts>>>Heat shock proteins>>>HSP20			molecular chaperone IbpA							O	COG0071		CyCOG_60002426	ko03110			K04080					gene
2411.0	c_000000000001	2505466	2506252			Amino acid transport and metabolism	Indole-3-glycerol phosphate synthase (TrpC) (PDB:6BMA)	Aromatic amino acid biosynthesis	indole-3-glycerol phosphate synthase	KEGG Orthology (KO)>>>09100 Metabolism>>>09105 Amino acid metabolism>>>00400 Phenylalanine, tyrosine and tryptophan biosynthesis [PATH:ko00400]!!!Enzymes>>>4. Lyases>>>4.1  Carbon-carbon lyases>>>4.1.1  Carboxy-lyases>>>4.1.1.48  indole-3-glycerol-phosphate synthase	Pathway modules; Amino acid metabolism; Aromatic amino acid metabolism	Tryptophan biosynthesis, chorismate => tryptophan	indole-3-glycerol phosphate synthase [EC:4.1.1.48]							E	COG0134	COG0134	CyCOG_60000809	ko00001!!!ko01000	M00023	M00023	K01609					gene
2412.0	c_000000000001	2506399	2507089			Transcription!!!Signal transduction mechanisms	SOS-response transcriptional repressor LexA (RecA-mediated autopeptidase) (LexA) (PDB:1AY9)		SOS-response transcriptional repressor, LexA	Enzymes>>>3. Hydrolases>>>3.4  Acting on peptide bonds (peptidases)>>>3.4.21  Serine endopeptidases>>>3.4.21.88  repressor LexA!!!Peptidases and inhibitors>>>Serine peptidases>>>Family S24: LexA family!!!DNA repair and recombination proteins>>>Prokaryotic type>>>TLS (translesion DNA synthesis) factors>>>Other SOS response factors			repressor LexA [EC:3.4.21.88]							K!!!T	COG1974		CyCOG_60000689	ko01000!!!ko01002!!!ko03400			K01356					gene
2416.0	c_000000000001	2512185	2513589			Signal transduction mechanisms	Signal transduction histidine kinase (BaeS) (PDB:1JOY)		hypothetical protein											T	COG0642		CyCOG_60004161									gene
2435.0	c_000000000001	2533327	2533996			Energy production and conversion	NADH:ubiquinone oxidoreductase 24 kD subunit (chain E) (NuoE) (PDB:5XF9)	NADH dehydrogenase	bidirectional hydrogenase complex protein HoxE	KEGG Orthology (KO)>>>09100 Metabolism>>>09102 Energy metabolism>>>00190 Oxidative phosphorylation [PATH:ko00190]!!!Enzymes>>>7. Translocases>>>7.1  Catalysing the translocation of protons>>>7.1.1  Linked to oxidoreductase reactions>>>7.1.1.2  NADH:ubiquinone reductase (H+-translocating)	Pathway modules; Energy metabolism; ATP synthesis	NADH:quinone oxidoreductase, prokaryotes	NADH-quinone oxidoreductase subunit E [EC:7.1.1.2]							C	COG1905	COG1905	CyCOG_60007734	ko00001!!!ko01000	M00144	M00144	K00334					gene
2441.0	c_000000000001	2537376	2537751			Energy production and conversion	NADH:ubiquinone oxidoreductase subunit 3 (chain A) (NuoA) (PDB:3RKO)	NADH dehydrogenase	NADH dehydrogenase subunit A	KEGG Orthology (KO)>>>09100 Metabolism>>>09102 Energy metabolism>>>00190 Oxidative phosphorylation [PATH:ko00190]!!!Enzymes>>>7. Translocases>>>7.1  Catalysing the translocation of protons>>>7.1.1  Linked to oxidoreductase reactions>>>7.1.1.2  NADH:ubiquinone reductase (H+-translocating)	Pathway modules; Energy metabolism; ATP synthesis	NADH:quinone oxidoreductase, prokaryotes	NADH-quinone oxidoreductase subunit A [EC:7.1.1.2]							C	COG0838	COG0838	CyCOG_60000182	ko00001!!!ko01000	M00144	M00144	K00330					gene
2442.0	c_000000000001	2537881	2539312			Lipid transport and metabolism	Acyl-CoA reductase or other NAD-dependent aldehyde dehydrogenase (AdhE) (PDB:1A4S)	Proline degradation	aldehyde dehydrogenase (NAD+)	KEGG Orthology (KO)>>>09190 Not Included in Pathway or Brite>>>09191 Unclassified: metabolism>>>99980 Enzymes with EC numbers!!!Enzymes>>>1. Oxidoreductases>>>1.2  Acting on the aldehyde or oxo group of donors>>>1.2.1  With NAD+ or NADP+ as acceptor>>>1.2.1.68  coniferyl-aldehyde dehydrogenase			coniferyl-aldehyde dehydrogenase [EC:1.2.1.68]							I	COG1012	COG1012	CyCOG_60000511	ko00001!!!ko01000			K00154					gene
