2008.0	c_000000000002	1932001	1932991			Carbohydrate transport and metabolism!!!Cell wall/membrane/envelope biogenesis!!!Signal transduction mechanisms	D-arabinose 5-phosphate isomerase GutQ (GutQ) (PDB:5UQI)!!!Signal-transduction protein containing cAMP-binding, CBS, and nucleotidyltransferase domains		arabinose-5-phosphate isomerase	KEGG Orthology (KO)>>>09100 Metabolism>>>09107 Glycan biosynthesis and metabolism>>>00540 Lipopolysaccharide biosynthesis [PATH:ko00540]!!!Enzymes>>>5. Isomerases>>>5.3  Intramolecular oxidoreductases>>>5.3.1  Interconverting aldoses and ketoses, and related compounds>>>5.3.1.13  arabinose-5-phosphate isomerase!!!Lipopolysaccharide biosynthesis proteins>>>Lipid A	Pathway modules; Glycan metabolism; Lipopolysaccharide metabolism	CMP-KDO biosynthesis	arabinose-5-phosphate isomerase [EC:5.3.1.13]							G!!!M!!!T	COG0794!!!COG2905		CyCOG_60029934	ko00001!!!ko01000!!!ko01005	M00063	M00063	K06041					gene
2009.0	c_000000000002	1933086	1934112			Cell wall/membrane/envelope biogenesis	Lyzozyme M1 (1,4-beta-N-acetylmuramidase), GH25 family (Acm) (PDB:1H09)			KEGG Orthology (KO)>>>09190 Not Included in Pathway or Brite>>>09193 Unclassified: signaling and cellular processes>>>99992 Structural proteins			lysozyme							M	COG3757			ko00001			K07273					gene
2010.0	c_000000000002	1934511	1935063			Transcription	DNA-directed RNA polymerase specialized sigma subunit, sigma24 family (RpoE) (PDB:2Q1Z)	RNA polymerase	RNA polymerase sigma-70 factor, ECF subfamily	Transcription machinery>>>Prokaryotic type>>>Bacterial type>>>RNA polymerase>>>Sigma factors			RNA polymerase sigma-70 factor, ECF subfamily							K	COG1595	COG1595	CyCOG_60004761	ko03021			K03088					gene
2014.0	c_000000000002	1937601	1938183			Posttranslational modification, protein turnover, chaperones	Predicted transglutaminase-like protein (PDB:4FGO)													O	COG3672											gene
2021.0	c_000000000002	1944302	1945601			Amino acid transport and metabolism	ABC-type branched-chain amino acid transport system, periplasmic component (LivK) (PDB:1USG)		urea-binding protein	KEGG Orthology (KO)>>>09130 Environmental Information Processing>>>09131 Membrane transport>>>02010 ABC transporters [PATH:ko02010]!!!Transporters>>>ABC transporters, prokaryotic type>>>Phosphate and amino acid transporters>>>Urea transporter			urea transport system substrate-binding protein							E	COG0683		CyCOG_60001296	ko00001!!!ko02000			K11959					gene
2028.0	c_000000000002	1952728	1954306			General function prediction only	ATPase components of ABC transporters with duplicated ATPase domains (Uup) (PDB:5ZXD)		ATP-binding cassette, subfamily F, uup											R	COG0488		CyCOG_60001615									gene
2036.0	c_000000000002	1961651	1962608			Transcription	DNA-binding transcriptional regulator LsrR, DeoR family (DeoR) (PDB:2GNP) (PUBMED:23974133;24893262)			Transcription machinery>>>Prokaryotic type>>>Bacterial type>>>RNA polymerase>>>Sigma factors			deoxyribonucleoside regulator							K	COG2390			ko03021			K05346					gene
2056.0	c_000000000002	1982091	1982487			Signal transduction mechanisms	Lipoprotein Med, regulator of KinD/Spo0A, PBP1-ABC superfamily, includes NupN (Med) (PDB:2FQW) (PUBMED:21622736)													T	COG1744											gene
2057.0	c_000000000002	1982656	1983451			Carbohydrate transport and metabolism	Archaeal fructose-1,6-bisphosphatase or related enzyme, inositol monophosphatase family (SuhB) (PDB:1AWB)	Gluconeogenesis	myo-inositol-1(or 4)-monophosphatase	KEGG Orthology (KO)>>>09100 Metabolism>>>09101 Carbohydrate metabolism>>>00562 Inositol phosphate metabolism [PATH:ko00562]!!!KEGG Orthology (KO)>>>09100 Metabolism>>>09110 Biosynthesis of other secondary metabolites>>>00521 Streptomycin biosynthesis [PATH:ko00521]!!!KEGG Orthology (KO)>>>09130 Environmental Information Processing>>>09132 Signal transduction>>>04070 Phosphatidylinositol signaling system [PATH:ko04070]!!!Enzymes>>>3. Hydrolases>>>3.1  Acting on ester bonds>>>3.1.3  Phosphoric-monoester hydrolases>>>3.1.3.25  inositol-phosphate phosphatase	Pathway modules; Carbohydrate metabolism; Other carbohydrate metabolism	Inositol phosphate metabolism, Ins(1,3,4,5)P4 => Ins(1,3,4)P3 => myo-inositol	myo-inositol-1(or 4)-monophosphatase [EC:3.1.3.25]							G	COG0483	COG0483	CyCOG_60001171	ko00001!!!ko00001!!!ko00001!!!ko01000	M00131	M00131	K01092					gene
2058.0	c_000000000002	1983674	1984199			Coenzyme transport and metabolism	Molybdopterin biosynthesis enzyme MoaB/MogA (MoaB) (PDB:1DI6) (PUBMED:32239579)	Molybdopterin biosynthesis	molybdenum cofactor biosynthesis protein B	KEGG Orthology (KO)>>>09100 Metabolism>>>09108 Metabolism of cofactors and vitamins>>>00790 Folate biosynthesis [PATH:ko00790]!!!KEGG Orthology (KO)>>>09120 Genetic Information Processing>>>09123 Folding, sorting and degradation>>>04122 Sulfur relay system [PATH:ko04122]!!!Enzymes>>>2. Transferases>>>2.7  Transferring phosphorus-containing groups>>>2.7.7  Nucleotidyltransferases>>>2.7.7.75  molybdopterin adenylyltransferase	Pathway modules; Metabolism of cofactors and vitamins; Cofactor and vitamin metabolism	Molybdenum cofactor biosynthesis, GTP => molybdenum cofactor	molybdopterin adenylyltransferase [EC:2.7.7.75]							H	COG0521	COG0521	CyCOG_60002850	ko00001!!!ko00001!!!ko01000	M00880	M00880	K03831					gene
2078.0	c_000000000002	2004356	2005103			Cell wall/membrane/envelope biogenesis	Peptidoglycan-binding (PGRP) domain of peptidoglycan hydrolases (PGRP) (PDB:4FET)													M	COG3409											gene
2079.0	c_000000000002	2005342	2006347			Amino acid transport and metabolism	L-asparaginase II (AnsA2)		asparaginase											E	COG4448		CyCOG_60001004									gene
2080.0	c_000000000002	2006343	2007729			Inorganic ion transport and metabolism	Nitrous oxide reductase accessory protein NosD, contains tandem CASH domains (NosD) (PDB:2KZW)													P	COG3420											gene
2082.0	c_000000000002	2008732	2010229			Signal transduction mechanisms!!!Signal transduction mechanisms	GGDEF domain, diguanylate cyclase (c-di-GMP synthetase) or its enzymatically inactive variants (GGDEF) (PDB:6D9M)!!!Extracellular (periplasmic) sensor domain CHASE (specificity unknown) (CHASE4)		diguanylate cyclase	KEGG Orthology (KO)>>>09140 Cellular Processes>>>09145 Cellular community - prokaryotes>>>05111 Biofilm formation - Vibrio cholerae [PATH:ko05111]!!!Enzymes>>>2. Transferases>>>2.7  Transferring phosphorus-containing groups>>>2.7.7  Nucleotidyltransferases>>>2.7.7.65  diguanylate cyclase			diguanylate cyclase [EC:2.7.7.65]							T!!!T	COG2199!!!COG3322		CyCOG_60008733	ko00001!!!ko01000			K21021					gene
2089.0	c_000000000002	2016932	2017586			Coenzyme transport and metabolism	FMN and 5-amino-6-(5-phospho-D-ribitylamino)uracil phosphatase YigB, HAD superfamily (riboflavin biosynthesis) (YigB) (PDB:4JB3) (PUBMED:24123841)			KEGG Orthology (KO)>>>09100 Metabolism>>>09111 Xenobiotics biodegradation and metabolism>>>00625 Chloroalkane and chloroalkene degradation [PATH:ko00625]!!!KEGG Orthology (KO)>>>09100 Metabolism>>>09111 Xenobiotics biodegradation and metabolism>>>00361 Chlorocyclohexane and chlorobenzene degradation [PATH:ko00361]!!!Enzymes>>>3. Hydrolases>>>3.8  Acting on halide bonds>>>3.8.1  In carbon-halide compounds>>>3.8.1.2  (S)-2-haloacid dehalogenase			2-haloacid dehalogenase [EC:3.8.1.2]							H	COG1011			ko00001!!!ko00001!!!ko01000			K01560					gene
2090.0	c_000000000002	2017769	2018990			General function prediction only	Zinc metallochaperone YeiR/ZagA and related GTPases, G3E family (YejR) (PDB:1NIJ) (PUBMED:19822009;31132310)		GTPase, G3E family	KEGG Orthology (KO)>>>09190 Not Included in Pathway or Brite>>>09191 Unclassified: metabolism>>>99987 Cofactor metabolism			cobalamin biosynthesis protein CobW							R	COG0523		CyCOG_60000581	ko00001			K02234					gene
2091.0	c_000000000002	2019286	2020156			Amino acid transport and metabolism!!!Coenzyme transport and metabolism	Branched-chain amino acid aminotransferase/4-amino-4-deoxychorismate lyase (IlvE) (PDB:1A3G)	Isoleucine, leucine, valine biosynthesis	branched chain amino acid aminotransferase apoenzyme	KEGG Orthology (KO)>>>09100 Metabolism>>>09105 Amino acid metabolism>>>00270 Cysteine and methionine metabolism [PATH:ko00270]!!!KEGG Orthology (KO)>>>09100 Metabolism>>>09105 Amino acid metabolism>>>00280 Valine, leucine and isoleucine degradation [PATH:ko00280]!!!KEGG Orthology (KO)>>>09100 Metabolism>>>09105 Amino acid metabolism>>>00290 Valine, leucine and isoleucine biosynthesis [PATH:ko00290]!!!KEGG Orthology (KO)>>>09100 Metabolism>>>09108 Metabolism of cofactors and vitamins>>>00770 Pantothenate and CoA biosynthesis [PATH:ko00770]!!!KEGG Orthology (KO)>>>09100 Metabolism>>>09110 Biosynthesis of other secondary metabolites>>>00966 Glucosinolate biosynthesis [PATH:ko00966]!!!Enzymes>>>2. Transferases>>>2.6  Transferring nitrogenous groups>>>2.6.1  Transaminases>>>2.6.1.42  branched-chain-amino-acid transaminase!!!Amino acid related enzymes>>>Aminotransferase (transaminase)>>>Class IV	Pathway modules; Amino acid metabolism; Branched-chain amino acid metabolism!!!Pathway modules; Amino acid metabolism; Branched-chain amino acid metabolism!!!Pathway modules; Amino acid metabolism; Branched-chain amino acid metabolism!!!Pathway modules; Metabolism of cofactors and vitamins; Cofactor and vitamin metabolism	Valine/isoleucine biosynthesis, pyruvate => valine / 2-oxobutanoate => isoleucine!!!Isoleucine biosynthesis, threonine => 2-oxobutanoate => isoleucine!!!Leucine degradation, leucine => acetoacetate + acetyl-CoA!!!Pantothenate biosynthesis, valine/L-aspartate => pantothenate	branched-chain amino acid aminotransferase [EC:2.6.1.42]							E!!!H	COG0115	COG0115	CyCOG_60001214	ko00001!!!ko00001!!!ko00001!!!ko00001!!!ko00001!!!ko01000!!!ko01007	M00019!!!M00570!!!M00036!!!M00119	M00019!!!M00570!!!M00036!!!M00119	K00826					gene
2092.0	c_000000000002	2020657	2021260			Inorganic ion transport and metabolism	Superoxide dismutase (SodA) (PDB:1AP5)		superoxide dismutase	KEGG Orthology (KO)>>>09130 Environmental Information Processing>>>09132 Signal transduction>>>04013 MAPK signaling pathway - fly [PATH:ko04013]!!!KEGG Orthology (KO)>>>09130 Environmental Information Processing>>>09132 Signal transduction>>>04068 FoxO signaling pathway [PATH:ko04068]!!!KEGG Orthology (KO)>>>09140 Cellular Processes>>>09141 Transport and catabolism>>>04146 Peroxisome [PATH:ko04146]!!!Enzymes>>>1. Oxidoreductases>>>1.15  Acting on superoxide as acceptor>>>1.15.1  Acting on superoxide as acceptor (only sub-subclass identified to date)>>>1.15.1.1  superoxide dismutase			superoxide dismutase, Fe-Mn family [EC:1.15.1.1]							P	COG0605		CyCOG_60005169	ko00001!!!ko00001!!!ko00001!!!ko01000			K04564					gene
2097.0	c_000000000002	2024444	2025677			Intracellular trafficking, secretion, and vesicular transport!!!Extracellular structures	Flp pilus assembly protein TadG, includes N-terminal TadE domain (TadG) (PUBMED:12010986)													U!!!W	COG4961											gene
2098.0	c_000000000002	2026053	2028147			Amino acid transport and metabolism	Protease II (PtrB) (PDB:4BP9)		Dipeptidyl aminopeptidase/acylaminoacyl peptidase	Enzymes>>>3. Hydrolases>>>3.4  Acting on peptide bonds (peptidases)>>>3.4.21  Serine endopeptidases>>>3.4.21.83  oligopeptidase B!!!Peptidases and inhibitors>>>Serine peptidases>>>Family S9: prolyl oligopeptidase family			oligopeptidase B [EC:3.4.21.83]							E	COG1770		CyCOG_60003232	ko01000!!!ko01002			K01354					gene
2099.0	c_000000000002	2028335	2029547			Carbohydrate transport and metabolism	Endo-1,4-beta-D-glucanase Y (BcsZ) (PDB:1CEM)													G	COG3405											gene
2107.0	c_000000000002	2035926	2036277			Inorganic ion transport and metabolism	Multisubunit Na+/H+ antiporter, MnhG subunit (MnhG) (PDB:6CFW)			Transporters>>>Other transporters>>>Electrochemical potential-driven transporters [TC:2]			multicomponent Na+:H+ antiporter subunit G							P	COG1320			ko02000			K05571					gene
2108.0	c_000000000002	2036682	2037120			Transcription	Predicted transcriptional regulator (PDB:2JSP)			Transcription factors>>>Prokaryotic type>>>Other transcription factors>>>Others			MucR family transcriptional regulator, transcriptional regulator of exopolysaccharide biosynthesis							K	COG4957			ko03000			K25884					gene
2116.0	c_000000000002	2043398	2044577			Function unknown	Uncharacterized conserved protein, DUF2336 family													S	COG5330											gene
2120.0	c_000000000002	2046420	2048598			Cell wall/membrane/envelope biogenesis	Penicillin-binding protein 1B/1F, peptidoglycan  transglycosylase/transpeptidase (MrcB) (PDB:3FWL)		penicillin-binding protein 1A	KEGG Orthology (KO)>>>09100 Metabolism>>>09107 Glycan biosynthesis and metabolism>>>00550 Peptidoglycan biosynthesis [PATH:ko00550]!!!Enzymes>>>2. Transferases>>>2.4  Glycosyltransferases>>>2.4.1  Hexosyltransferases>>>2.4.1.129  peptidoglycan glycosyltransferase!!!Enzymes>>>3. Hydrolases>>>3.4  Acting on peptide bonds (peptidases)>>>3.4.16  Serine-type carboxypeptidases>>>3.4.16.4  serine-type D-Ala-D-Ala carboxypeptidase!!!Glycosyltransferases>>>Polysaccharide>>>Bacterial polysaccharide (excluding LPS)!!!Peptidoglycan biosynthesis and degradation proteins>>>Peptidoglycan biosynthesis and degradation>>>Glycosyltransferase/DD-Transpeptidase (Class A PBP)			penicillin-binding protein 1A [EC:2.4.1.129 3.4.16.4]							M	COG0744		CyCOG_60001206	ko00001!!!ko01000!!!ko01000!!!ko01003!!!ko01011			K05366					gene
2121.0	c_000000000002	2048761	2049226			General function prediction only	Uncharacterized cysteine cluster protein YcgN, CxxCxxCC family (YcgN)			KEGG Orthology (KO)>>>09190 Not Included in Pathway or Brite>>>09194 Poorly characterized>>>99997 Function unknown			uncharacterized protein							R	COG2983			ko00001			K09160					gene
2122.0	c_000000000002	2049305	2050847			General function prediction only	Uncharacterized conserved protein related to deoxyribodipyrimidine photolyase (PDB:3ZXS)		deoxyribodipyrimidine photolyase-related protein	Enzymes>>>4. Lyases>>>4.1  Carbon-carbon lyases>>>4.1.99  Other carbon-carbon lyases>>>4.1.99.13  (6-4)DNA photolyase!!!DNA repair and recombination proteins>>>Prokaryotic type>>>SSBR (single strand breaks repair)>>>Direct repair			(6-4)DNA photolyase [EC:4.1.99.13]							R	COG3046		CyCOG_60036132	ko01000!!!ko03400			K06876					gene
2132.0	c_000000000002	2057400	2058702			Mobilome: prophages, transposons	Predicted phage phi-C31 gp36 major capsid-like protein (gp36)		phage prohead protease, HK97 family/phage major capsid protein, HK97 family,TIGR01554											X	COG4653		CyCOG_60002809									gene
2150.0	c_000000000002	2072706	2073177			Energy production and conversion!!!Posttranslational modification, protein turnover, chaperones	Cytochrome c biogenesis protein CcmE (CcmE) (PDB:1J6Q)			KEGG Orthology (KO)>>>09190 Not Included in Pathway or Brite>>>09193 Unclassified: signaling and cellular processes>>>99992 Structural proteins			cytochrome c-type biogenesis protein CcmE							C!!!O	COG2332			ko00001			K02197					gene
2151.0	c_000000000002	2073234	2075220			Energy production and conversion!!!Posttranslational modification, protein turnover, chaperones	Cytochrome c biogenesis protein CcmF (CcmF)			Transporters>>>Other transporters>>>Others			cytochrome c-type biogenesis protein CcmF							C!!!O	COG1138			ko02000			K02198					gene
2158.0	c_000000000002	2083415	2085866			Signal transduction mechanisms!!!Signal transduction mechanisms	Signal transduction histidine kinase (BaeS) (PDB:1JOY)!!!PAS domain (PAS) (PDB:2MWG)		PAS protein	KEGG Orthology (KO)>>>09130 Environmental Information Processing>>>09132 Signal transduction>>>02020 Two-component system [PATH:ko02020]!!!KEGG Orthology (KO)>>>09140 Cellular Processes>>>09143 Cell growth and death>>>04112 Cell cycle - Caulobacter [PATH:ko04112]!!!Enzymes>>>2. Transferases>>>2.7  Transferring phosphorus-containing groups>>>2.7.13  Protein-histidine kinases>>>2.7.13.3  histidine kinase!!!Protein kinases>>>Histidine kinases>>>Cell cycle family [OT]!!!Two-component system>>>Cell cycle family>>>PleC-PleD (cell fate control)			two-component system, cell cycle sensor histidine kinase PleC [EC:2.7.13.3]							T!!!T	COG0642!!!COG2202		CyCOG_60031048	ko00001!!!ko00001!!!ko01000!!!ko01001!!!ko02022			K07716					gene
2159.0	c_000000000002	2086112	2088749			Amino acid transport and metabolism	Aminopeptidase N, contains DUF3458 domain (PepN) (PDB:6ATK) (PUBMED:24123841)		aminopeptidase N	KEGG Orthology (KO)>>>09100 Metabolism>>>09106 Metabolism of other amino acids>>>00480 Glutathione metabolism [PATH:ko00480]!!!Enzymes>>>3. Hydrolases>>>3.4  Acting on peptide bonds (peptidases)>>>3.4.11  Aminopeptidases>>>3.4.11.2  membrane alanyl aminopeptidase!!!Peptidases and inhibitors>>>Metallo peptidases>>>Family M1			aminopeptidase N [EC:3.4.11.2]							E	COG0308		CyCOG_60001089	ko00001!!!ko01000!!!ko01002			K01256					gene
2160.0	c_000000000002	2088827	2091242			Energy production and conversion	Aldehyde, CO or xanthine dehydrogenase, Mo-binding subunit (CoxL) (PDB:1DGJ) (PUBMED:10095793)	Non-phosphorylated Entner-Doudoroff pathway		KEGG Orthology (KO)>>>09190 Not Included in Pathway or Brite>>>09191 Unclassified: metabolism>>>99980 Enzymes with EC numbers!!!Enzymes>>>1. Oxidoreductases>>>1.2  Acting on the aldehyde or oxo group of donors>>>1.2.5  With a quinone or similar compound as acceptor>>>1.2.5.3  aerobic carbon monoxide dehydrogenase			aerobic carbon-monoxide dehydrogenase large subunit [EC:1.2.5.3]							C	COG1529	COG1529		ko00001!!!ko01000			K03520					gene
2162.0	c_000000000002	2092250	2093543			Carbohydrate transport and metabolism	Predicted arabinose efflux permease AraJ, MFS family (AraJ) (PDB:4LDS)													G	COG2814											gene
2163.0	c_000000000002	2093830	2094727			Replication, recombination and repair	Uracil-DNA glycosylase (Udg4) (PDB:3IKB)		DNA polymerase	KEGG Orthology (KO)>>>09120 Genetic Information Processing>>>09124 Replication and repair>>>03410 Base excision repair [PATH:ko03410]!!!Enzymes>>>3. Hydrolases>>>3.2  Glycosylases>>>3.2.2  Hydrolysing N-glycosyl compounds>>>3.2.2.27  uracil-DNA glycosylase!!!DNA repair and recombination proteins>>>Prokaryotic type>>>SSBR (single strand breaks repair)>>>BER (base exicision repair)>>>DNA glycosylases			uracil-DNA glycosylase [EC:3.2.2.27]							L	COG1573		CyCOG_60001147	ko00001!!!ko01000!!!ko03400			K21929					gene
2176.0	c_000000000002	2105312	2106575			Lipid transport and metabolism!!!Secondary metabolites biosynthesis, transport and catabolism	3-oxoacyl-(acyl-carrier-protein) synthase (FabB) (PDB:2UV8) (PUBMED:21652641)	Fatty acid biosynthesis	3-oxoacyl-[acyl-carrier-protein] synthase II	KEGG Orthology (KO)>>>09100 Metabolism>>>09103 Lipid metabolism>>>00061 Fatty acid biosynthesis [PATH:ko00061]!!!KEGG Orthology (KO)>>>09100 Metabolism>>>09108 Metabolism of cofactors and vitamins>>>00780 Biotin metabolism [PATH:ko00780]!!!Enzymes>>>2. Transferases>>>2.3  Acyltransferases>>>2.3.1  Transferring groups other than aminoacyl groups>>>2.3.1.179  beta-ketoacyl-[acyl-carrier-protein] synthase II!!!Lipid biosynthesis proteins>>>Fatty acid synthase>>>Component type	Pathway modules; Lipid metabolism; Fatty acid metabolism!!!Pathway modules; Lipid metabolism; Fatty acid metabolism!!!Pathway modules; Lipid metabolism; Fatty acid metabolism!!!Pathway modules; Metabolism of cofactors and vitamins; Cofactor and vitamin metabolism	Fatty acid biosynthesis, elongation!!!Fatty acid biosynthesis in mitochondria, animals!!!Fatty acid biosynthesis in mitochondria, fungi!!!Pimeloyl-ACP biosynthesis, BioC-BioH pathway, malonyl-ACP => pimeloyl-ACP	3-oxoacyl-[acyl-carrier-protein] synthase II [EC:2.3.1.179]							I!!!Q	COG0304	COG0304	CyCOG_60000116	ko00001!!!ko00001!!!ko01000!!!ko01004	M00083!!!M00873!!!M00874!!!M00572	M00083!!!M00873!!!M00874!!!M00572	K09458					gene
2177.0	c_000000000002	2106708	2107920			Cell wall/membrane/envelope biogenesis	Endolytic transglycosylase MltG, terminates peptidoglycan polymerization (MltG) (PDB:2R1F) (PUBMED:26507882)			KEGG Orthology (KO)>>>09190 Not Included in Pathway or Brite>>>09194 Poorly characterized>>>99996 General function prediction only			UPF0755 protein							M	COG1559			ko00001			K07082					gene
2185.0	c_000000000002	2116051	2117260			Cell wall/membrane/envelope biogenesis!!!Cell motility	Lipopolysaccharide export LptBFGC system, permease protein LptF (LptF) (PDB:6S8H)			KEGG Orthology (KO)>>>09130 Environmental Information Processing>>>09131 Membrane transport>>>02010 ABC transporters [PATH:ko02010]!!!Transporters>>>ABC transporters, prokaryotic type>>>ABC-2 type and other transporters>>>Lipopolysaccharide transporter			lipopolysaccharide export system permease protein							M!!!N	COG0795			ko00001!!!ko02000			K07091					gene
2186.0	c_000000000002	2117636	2119121			Amino acid transport and metabolism	Leucyl aminopeptidase (PepB) (PDB:3H8E) (PUBMED:19553197;23825549)		leucyl aminopeptidase	KEGG Orthology (KO)>>>09100 Metabolism>>>09106 Metabolism of other amino acids>>>00480 Glutathione metabolism [PATH:ko00480]!!!Enzymes>>>3. Hydrolases>>>3.4  Acting on peptide bonds (peptidases)>>>3.4.11  Aminopeptidases>>>3.4.11.1  leucyl aminopeptidase!!!Peptidases and inhibitors>>>Metallo peptidases>>>Family M17: leucyl aminopeptidase family			leucyl aminopeptidase [EC:3.4.11.1]							E	COG0260		CyCOG_60000786	ko00001!!!ko01000!!!ko01002			K01255					gene
2192.0	c_000000000002	2124322	2126344			General function prediction only	ATPase components of ABC transporters with duplicated ATPase domains (Uup) (PDB:5ZXD)		ATP-binding cassette, subfamily F, member 3	Translation factors>>>Eukaryotic type>>>Initiation factors>>>Initiation associated factors			ATP-binding cassette, subfamily F, member 3							R	COG0488		CyCOG_60000532	ko03012			K06158					gene
2199.0	c_000000000002	2131053	2131515			Transcription	DNA-binding transcriptional regulator, Lrp family (Lrp) (PDB:1I1G)			Transcription factors>>>Prokaryotic type>>>Helix-turn-helix>>>Lrp/AsnC family!!!Chromosome and associated proteins>>>Prokaryotic type>>>Nucleoid associated proteins>>>Other nucleoid associated proteins			Lrp/AsnC family transcriptional regulator, leucine-responsive regulatory protein							K	COG1522			ko03000!!!ko03036			K03719					gene
2200.0	c_000000000002	2131648	2132269			Amino acid transport and metabolism	Threonine/homoserine/homoserine lactone efflux protein (RhtB)			Transporters>>>Other transporters>>>Electrochemical potential-driven transporters [TC:2]!!!Bacterial motility proteins>>>Pilus system>>>Chemosensory pili system proteins			homoserine/homoserine lactone efflux protein							E	COG1280			ko02000!!!ko02035			K05834					gene
2206.0	c_000000000002	2136468	2137239			Lipid transport and metabolism	NAD(P)-dependent dehydrogenase, short-chain alcohol dehydrogenase family (FabG) (PDB:6L1H)	Fatty acid biosynthesis	pteridine reductase	KEGG Orthology (KO)>>>09190 Not Included in Pathway or Brite>>>09191 Unclassified: metabolism>>>99980 Enzymes with EC numbers!!!Enzymes>>>1. Oxidoreductases>>>1.1  Acting on the CH-OH group of donors>>>1.1.1  With NAD+ or NADP+ as acceptor>>>1.1.1.320  benzil reductase [(S)-benzoin forming]			pteridine reductase [EC:1.5.1.33]							I	COG1028	COG1028	CyCOG_60021313	ko00001!!!ko01000			K03793					gene
2207.0	c_000000000002	2137268	2138210			Inorganic ion transport and metabolism	Ca2+/Na+ antiporter (ECM27) (PDB:3V5S)		cation:H+ antiporter	Transporters>>>Other transporters>>>Electrochemical potential-driven transporters [TC:2]			cation:H+ antiporter							P	COG0530		CyCOG_60000656	ko02000			K07301					gene
2222.0	c_000000000002	2150716	2151787			Nucleotide transport and metabolism	Phosphoribosylaminoimidazole (AIR) synthetase (PurM) (PDB:1CLI)	Purine biosynthesis	phosphoribosylformylglycinamidine cyclo-ligase	KEGG Orthology (KO)>>>09100 Metabolism>>>09104 Nucleotide metabolism>>>00230 Purine metabolism [PATH:ko00230]!!!Enzymes>>>6. Ligases>>>6.3  Forming carbon-nitrogen bonds>>>6.3.3  Cyclo-ligases>>>6.3.3.1  phosphoribosylformylglycinamidine cyclo-ligase	Pathway modules; Nucleotide metabolism; Purine metabolism	De novo purine biosynthesis, PRPP + glutamine => IMP	phosphoribosylformylglycinamidine cyclo-ligase [EC:6.3.3.1]							F	COG0150	COG0150	CyCOG_60000117	ko00001!!!ko01000	M00048	M00048	K01933					gene
2223.0	c_000000000002	2152297	2152834			Lipid transport and metabolism	Phosphatidylglycerophosphate synthase (PgsA) (PDB:4MND)	Phospholipid biosynthesis	CDP-diacylglycerol--glycerol-3-phosphate 3-phosphatidyltransferase	KEGG Orthology (KO)>>>09100 Metabolism>>>09103 Lipid metabolism>>>00564 Glycerophospholipid metabolism [PATH:ko00564]!!!Enzymes>>>2. Transferases>>>2.7  Transferring phosphorus-containing groups>>>2.7.8  Transferases for other substituted phosphate groups>>>2.7.8.41  cardiolipin synthase (CMP-forming)			cardiolipin synthase (CMP-forming) [EC:2.7.8.41]							I	COG0558	COG0558	CyCOG_60011534	ko00001!!!ko01000			K08744					gene
2225.0	c_000000000002	2154039	2154744			Replication, recombination and repair	Chromosomal replication initiation ATPase DnaA (DnaA) (PDB:1L8Q)													L	COG0593											gene
2226.0	c_000000000002	2154819	2157069			Inorganic ion transport and metabolism	Polyphosphate kinase (Ppk) (PDB:1XDO)		polyphosphate kinase	KEGG Orthology (KO)>>>09100 Metabolism>>>09102 Energy metabolism>>>00190 Oxidative phosphorylation [PATH:ko00190]!!!KEGG Orthology (KO)>>>09120 Genetic Information Processing>>>09123 Folding, sorting and degradation>>>03018 RNA degradation [PATH:ko03018]!!!Enzymes>>>2. Transferases>>>2.7  Transferring phosphorus-containing groups>>>2.7.4  Phosphotransferases with a phosphate group as acceptor>>>2.7.4.1  ATP-polyphosphate phosphotransferase!!!Messenger RNA biogenesis>>>Prokaryotic type>>>Bacterial mRNA degradation factors>>>Other RNA degradation factors>>>Others			polyphosphate kinase [EC:2.7.4.1]							P	COG0855		CyCOG_60000178	ko00001!!!ko00001!!!ko01000!!!ko03019			K00937					gene
